Tweets,Tweet,Tweet2,Tweet3
Samsung Electronics to invest more than $1 billion in U.S. chip production http:// flip.it/QZbDdl,Samsung Electronics to invest more than $1 billion in U.S. chip production http:// flip.it/QZbDdl,samsung electronics to invest more than  billion in u s chip production http flip it qzbddl,samsung electronics invest  billion chip production http flip qzbddl
#iPhone #android ?????? ?????? ????????? ????????? ????? ???????? ?? ????? ???? #iPad #Samsung,#iPhone #android ?????? ?????? ????????? ????????? ????? ???????? ?? ????? ???? #iPad #Samsung,iphone android          ipad samsung,iphone android          ipad samsung
Titik Balik Samsung : Samsung sudah menyiapkan Galaxy S8 untuk membuka 2017. http:// bit.ly/2ebm2Ls,Titik Balik Samsung : Samsung sudah menyiapkan Galaxy S8 untuk membuka 2017. http:// bit.ly/2ebm2Ls,titik balik samsung  samsung sudah menyiapkan galaxy s untuk membuka  http bit ly ebm ls,titik balik samsung  samsung sudah menyiapkan galaxy untuk membuka  http bit ly ebm ls
#llaverotec #llaverotec The Samsung Galaxy S8 could be mostly screen - CNET http:// dlvr.it/MZNrnb ? https:// twitter.com/llaverotec/sta tus/793574642954883072 ?,#llaverotec #llaverotec The Samsung Galaxy S8 could be mostly screen - CNET http:// dlvr.it/MZNrnb ? https:// twitter.com/llaverotec/sta tus/793574642954883072 ?,llaverotec llaverotec the samsung galaxy s could be mostly screen  cnet http dlvr it mznrnb  https twitter com llaverotec sta tus,llaverotec llaverotec samsung galaxy screen  cnet http dlvr mznrnb  https twitter com llaverotec sta tus
"#Cell #Phones #3: Samsung Galaxy S7, Black 32GB (Verizon Wireless): Samsung Galaxy S7, Black 32GB (V... http:// amzn.to/2ekHG39 #Service","#Cell #Phones #3: Samsung Galaxy S7, Black 32GB (Verizon Wireless): Samsung Galaxy S7, Black 32GB (V... http:// amzn.to/2ekHG39 #Service",cell phones  samsung galaxy s black gb verizon wireless samsung galaxy s black gb v http amzn to ekhg  service,cell phones  samsung galaxy black gb verizon wireless samsung galaxy black gb http amzn ekhg  service
The Samsung Galaxy S8 could be mostly screen - CNET: A recent Korean report suggests that the front of th... http:// cnet.co/2ebfBId,The Samsung Galaxy S8 could be mostly screen - CNET: A recent Korean report suggests that the front of th... http:// cnet.co/2ebfBId,the samsung galaxy s could be mostly screen  cnet a recent korean report suggests that the front of th http cnet co ebfbid, samsung galaxy screen  cnet recent korean report suggests th http cnet ebfbid
Sorry Samsung and Apple I dont think this is a great trend. http:// goo.gl/osHMwk #socialmedia #writing,Sorry Samsung and Apple I dont think this is a great trend. http:// goo.gl/osHMwk #socialmedia #writing,sorry samsung and apple i dont think this is a great trend http goo gl oshmwk socialmedia writing,sorry samsung apple dont think great trend http goo gl oshmwk socialmedia writing
The Samsung Galaxy S8 could be mostly screen - CNET: A recent Korean report suggests that the front of th... http:// cnet.co/2ebfBId,The Samsung Galaxy S8 could be mostly screen - CNET: A recent Korean report suggests that the front of th... http:// cnet.co/2ebfBId,the samsung galaxy s could be mostly screen  cnet a recent korean report suggests that the front of th http cnet co ebfbid, samsung galaxy screen  cnet recent korean report suggests th http cnet ebfbid
Samsung presentar? esta semana una pantalla flexible para smartphones http:// bit.ly/2b56neR pic.twitter.com/QwJOkJBQju,Samsung presentar? esta semana una pantalla flexible para smartphones http:// bit.ly/2b56neR pic.twitter.com/QwJOkJBQju,samsung presentar esta semana una pantalla flexible para smartphones http bit ly b ner pic twitter com qwjokjbqju,samsung presentar esta semana una pantalla flexible para smartphones http bit ly ner pic twitter com qwjokjbqju
#Samsung Galaxy S8 podr?a incluir una nueva pantalla 4K http:// ow.ly/1V4c305JOM6 #Tecnolog?a,#Samsung Galaxy S8 podr?a incluir una nueva pantalla 4K http:// ow.ly/1V4c305JOM6 #Tecnolog?a,samsung galaxy s podr a incluir una nueva pantalla k http ow ly v c jom  tecnolog a,samsung galaxy podr incluir una nueva pantalla http ow ly jom  tecnolog 
Samsung dropping $1B over the next year at the Austin campus? Yeah that sounds good to me...,Samsung dropping $1B over the next year at the Austin campus? Yeah that sounds good to me...,samsung dropping b over the next year at the austin campus yeah that sounds good to me,samsung dropping year austin campus yeah sounds good 
Samsung Galaxy S6 edge is getting the October security update too http:// bit.ly/2fsJo57,Samsung Galaxy S6 edge is getting the October security update too http:// bit.ly/2fsJo57,samsung galaxy s edge is getting the october security update too http bit ly fsjo,samsung galaxy edge getting october security update http bit ly fsjo
Samsung crowd y - straight-up-and-down diastrophism incoming yours snitch: odcPLBrTJ http:// dlvr.it/MZNtTM,Samsung crowd y - straight-up-and-down diastrophism incoming yours snitch: odcPLBrTJ http:// dlvr.it/MZNtTM,samsung crowd y  straight up and down diastrophism incoming yours snitch odcplbrtj http dlvr it mznttm,samsung crowd  straight diastrophism incoming snitch odcplbrtj http dlvr mznttm
i hate samsung emoji's,i hate samsung emoji's,i hate samsung emoji s, hate samsung emoji 
"Agree with Rex but sorry, @EricZorn , storm not the best analogy. This is: ""iPhone 7 has no headphone jack but Samsung literally explodes."" https:// twitter.com/rexhuppke/stat us/793538266767122432 ?","Agree with Rex but sorry, @EricZorn , storm not the best analogy. This is: ""iPhone 7 has no headphone jack but Samsung literally explodes."" https:// twitter.com/rexhuppke/stat us/793538266767122432 ?","agree with rex but sorry  ericzorn  storm not the best analogy this is ""iphone  has no headphone jack but samsung literally explodes "" https twitter com rexhuppke stat us","agree rex sorry  ericzorn  storm best analogy ""iphone  headphone jack samsung literally explodes "" https twitter com rexhuppke stat "
Samsung Galaxy S7 Edge 32GB Black (AT&T) Smartphone g935a Giveaway RT & Follow pic.twitter.com/T49Jbh1wIl,Samsung Galaxy S7 Edge 32GB Black (AT&T) Smartphone g935a Giveaway RT & Follow pic.twitter.com/T49Jbh1wIl,samsung galaxy s edge gb black at t smartphone g a giveaway rt  follow pic twitter com t jbh wil,samsung galaxy edge gb black smartphone giveaway rt  follow pic twitter com jbh wil
Why waiting for #Unlockcodes ? #SRS Just did Instant Unlock by cable on an #Samsung #I337M ..,Why waiting for #Unlockcodes ? #SRS Just did Instant Unlock by cable on an #Samsung #I337M ..,why waiting for unlockcodes  srs just did instant unlock by cable on an samsung i m, waiting unlockcodes  srs just did instant unlock cable samsung 
From what cause high samsung copy editor conjunction samsung toners capital ship live an hissing voice: CzSuR,From what cause high samsung copy editor conjunction samsung toners capital ship live an hissing voice: CzSuR,from what cause high samsung copy editor conjunction samsung toners capital ship live an hissing voice czsur, cause high samsung copy editor conjunction samsung toners capital ship live hissing voice czsur
#BreakingNews The Samsung Galaxy S8 could be mostly screen - CNET http:// dlvr.it/MZNt9W,#BreakingNews The Samsung Galaxy S8 could be mostly screen - CNET http:// dlvr.it/MZNt9W,breakingnews the samsung galaxy s could be mostly screen  cnet http dlvr it mznt w,breakingnews samsung galaxy screen  cnet http dlvr mznt 
Why Samsung Still Doesn?t Know What?s Causing Galaxy Note7 Explosions | Investigating the issue takes time.? http:// dlvr.it/MZNt4R #SYAC pic.twitter.com/GxazfcFT5v,Why Samsung Still Doesn?t Know What?s Causing Galaxy Note7 Explosions | Investigating the issue takes time.? http:// dlvr.it/MZNt4R #SYAC pic.twitter.com/GxazfcFT5v,why samsung still doesn t know what s causing galaxy note explosions | investigating the issue takes time http dlvr it mznt r syac pic twitter com gxazfcft v, samsung doesn know causing galaxy note explosions | investigating issue takes time http dlvr mznt syac pic twitter com gxazfcft 
The Samsung Galaxy S8 could be mostly screen - CNET http:// dlvr.it/MZNt17,The Samsung Galaxy S8 could be mostly screen - CNET http:// dlvr.it/MZNt17,the samsung galaxy s could be mostly screen  cnet http dlvr it mznt, samsung galaxy screen  cnet http dlvr mznt
The Samsung Galaxy S8 could be mostly screen - CNET: A recent Korean report suggests that the front of the next? https://www. cnet.com/news/samsung-g alaxy-s8-full-screen/?utm_source=dlvr.it&utm_medium=twitter#ftag=CAD590a51e ?,The Samsung Galaxy S8 could be mostly screen - CNET: A recent Korean report suggests that the front of the next? https://www. cnet.com/news/samsung-g alaxy-s8-full-screen/?utm_source=dlvr.it&utm_medium=twitter#ftag=CAD590a51e ?,the samsung galaxy s could be mostly screen  cnet a recent korean report suggests that the front of the next https www cnet com news samsung g alaxy s full screen utm_source dlvr it utm_medium twitter ftag cad a e, samsung galaxy screen  cnet recent korean report suggests https www cnet com news samsung alaxy screen utm_source dlvr utm_medium twitter ftag cad 
"I liked a @YouTube video http:// youtu.be/flu0dWS4-a0?a TV Comparison: Sony Z9D Series, Samsung KS9000, and the LG OLED G6P","I liked a @YouTube video http:// youtu.be/flu0dWS4-a0?a TV Comparison: Sony Z9D Series, Samsung KS9000, and the LG OLED G6P",i liked a youtube video http youtu be flu dws a a tv comparison sony z d series samsung ks and the lg oled g p, liked youtube video http youtu flu dws a tv comparison sony series samsung ks lg oled 
What Will Samsung Do With Its 4.3 Million Recalled Smartphones? #germany http://www. ecowatch.com/samsung-galaxy -note-7-recall-2074171431.html?utm_source=EcoWatch+List&utm_campaign=24fd7f44ed-MailChimp+Email+Blast&utm_medium=email&utm_term=0_49c7d43dc9-24fd7f44ed-86072005 ?,What Will Samsung Do With Its 4.3 Million Recalled Smartphones? #germany http://www. ecowatch.com/samsung-galaxy -note-7-recall-2074171431.html?utm_source=EcoWatch+List&utm_campaign=24fd7f44ed-MailChimp+Email+Blast&utm_medium=email&utm_term=0_49c7d43dc9-24fd7f44ed-86072005 ?,what will samsung do with its  million recalled smartphones  germany http www ecowatch com samsung galaxy note recall html utm_source ecowatch list utm_campaign fd f ed mailchimp email blast utm_medium email utm_term _ c d dc fd f ed, samsung  million recalled smartphones  germany http www ecowatch com samsung galaxy note recall html utm_source ecowatch list utm_campaign fd ed mailchimp email blast utm_medium email utm_term _ dc fd ed
"ugh I hate the emojis on this update, they look like samsung emojis","ugh I hate the emojis on this update, they look like samsung emojis",ugh i hate the emojis on this update they look like samsung emojis,ugh hate emojis update look like samsung emojis
Yo - watching your videos on a Samsung curve TV and they look farrr too dope - so crisp. @JustinEscalona,Yo - watching your videos on a Samsung curve TV and they look farrr too dope - so crisp. @JustinEscalona,yo  watching your videos on a samsung curve tv and they look farrr too dope  so crisp  justinescalona,yo  watching videos samsung curve tv look farrr dope  crisp  justinescalona
Il y a 70 ans : La t?l?vision oeil de demain @Ina_audiovisuel - v?ritable film d'anticipation #Apple #samsung http:// m.ina.fr/video/I10257139,Il y a 70 ans : La t?l?vision oeil de demain @Ina_audiovisuel - v?ritable film d'anticipation #Apple #samsung http:// m.ina.fr/video/I10257139,il y a  ans  la t l vision oeil de demain ina_audiovisuel  v ritable film d anticipation apple samsung http m ina fr video i,il  ans  la vision oeil demain ina_audiovisuel  ritable film anticipation apple samsung http ina fr video 
#ebuy NEW!! Samsung Galaxy J3 6 Verizon PREPAID Smartphone FREE SHIPPING!: $77.00 (6 Bids) End Date:? http:// dlvr.it/MZNspv #shopping pic.twitter.com/lyVqfDo74y,#ebuy NEW!! Samsung Galaxy J3 6 Verizon PREPAID Smartphone FREE SHIPPING!: $77.00 (6 Bids) End Date:? http:// dlvr.it/MZNspv #shopping pic.twitter.com/lyVqfDo74y,ebuy new samsung galaxy j  verizon prepaid smartphone free shipping   bids end date http dlvr it mznspv shopping pic twitter com lyvqfdo y,ebuy new samsung galaxy  verizon prepaid smartphone free shipping   bids end date http dlvr mznspv shopping pic twitter com lyvqfdo 
Free on @Listia : New in the box Samsung Galaxy s7 64GB Black Factory Unlocked. Get it here - https://www. listia.com/r21xxc0/BHVMYM,Free on @Listia : New in the box Samsung Galaxy s7 64GB Black Factory Unlocked. Get it here - https://www. listia.com/r21xxc0/BHVMYM,free on listia  new in the box samsung galaxy s  gb black factory unlocked get it here  https www listia com r xxc bhvmym,free listia  new box samsung galaxy  gb black factory unlocked  https www listia com xxc bhvmym
#iPhone #android Instagram ???????????? ??????? ?????? ? ?????? ? ?????????? #iPad #Samsung,#iPhone #android Instagram ???????????? ??????? ?????? ? ?????? ? ?????????? #iPad #Samsung,iphone android instagram        ipad samsung,iphone android instagram        ipad samsung
#ebuy LOT OF 8 OLD CELL PHONES: Nokia 5120 6340i Samsung Flip Chargers Bundle: $9.99 (0 Bids) End Date:? http:// dlvr.it/MZNskF #shopping pic.twitter.com/e95IlennIL,#ebuy LOT OF 8 OLD CELL PHONES: Nokia 5120 6340i Samsung Flip Chargers Bundle: $9.99 (0 Bids) End Date:? http:// dlvr.it/MZNskF #shopping pic.twitter.com/e95IlennIL,ebuy lot of  old cell phones nokia  i samsung flip chargers bundle   bids end date http dlvr it mznskf shopping pic twitter com e ilennil,ebuy lot  old cell phones nokia  samsung flip chargers bundle   bids end date http dlvr mznskf shopping pic twitter com ilennil
Samsung Galaxy S7 Edge 32GB Black (AT&T) Smartphone g935a pic.twitter.com/1WGaVOsPwe,Samsung Galaxy S7 Edge 32GB Black (AT&T) Smartphone g935a pic.twitter.com/1WGaVOsPwe,samsung galaxy s edge gb black at t smartphone g a pic twitter com wgavospwe,samsung galaxy edge gb black smartphone pic twitter com wgavospwe
#Berita : Titik Balik Samsung http:// bit.ly/2ekMwxa ? By #SbyCuk pic.twitter.com/Rx7ivSpr5K,#Berita : Titik Balik Samsung http:// bit.ly/2ekMwxa ? By #SbyCuk pic.twitter.com/Rx7ivSpr5K,berita  titik balik samsung http bit ly ekmwxa  by sbycuk pic twitter com rx ivspr k,berita  titik balik samsung http bit ly ekmwxa  sbycuk pic twitter com rx ivspr 
"Participa! SORTEO INTERNACIONAL | Samsung Galaxy S7 Dorado de @DonAndroidWeb , ?como participar? Ve el video https:// youtu.be/te0Fp-BOmTg","Participa! SORTEO INTERNACIONAL | Samsung Galaxy S7 Dorado de @DonAndroidWeb , ?como participar? Ve el video https:// youtu.be/te0Fp-BOmTg",participa sorteo internacional | samsung galaxy s dorado de donandroidweb  como participar ve el video https youtu be te fp bomtg,participa sorteo internacional | samsung galaxy dorado donandroidweb  como participar ve el video https youtu te fp bomtg
En Venta Samsung Galaxy S6 32GB Nuevo Gold Desbloqueado de F?brica Garantia Incluida? https://www. instagram.com/p/BMSJ8xVDacM/,En Venta Samsung Galaxy S6 32GB Nuevo Gold Desbloqueado de F?brica Garantia Incluida? https://www. instagram.com/p/BMSJ8xVDacM/,en venta samsung galaxy s  gb nuevo gold desbloqueado de f brica garantia incluida https www instagram com p bmsj xvdacm,en venta samsung galaxy  gb nuevo gold desbloqueado brica garantia incluida https www instagram com bmsj xvdacm
Samsung UN40J5200 40 Inch 1080p Smart LED TV hi tv via eBay http:// ift.tt/2fc9qcB ...,Samsung UN40J5200 40 Inch 1080p Smart LED TV hi tv via eBay http:// ift.tt/2fc9qcB ...,samsung un j  inch p smart led tv hi tv via ebay http ift tt fc qcb,samsung  inch smart led tv hi tv ebay http ift tt fc qcb
A large hit 2 the @samsung #brand along with the death of the #Note7 . I perdict many @Apple purchases for #Christmas http:// bit.ly/2dZXkSR,A large hit 2 the @samsung #brand along with the death of the #Note7 . I perdict many @Apple purchases for #Christmas http:// bit.ly/2dZXkSR,a large hit  the samsung brand along with the death of the note  i perdict many apple purchases for christmas http bit ly dzxksr, large hit  samsung brand death note  perdict apple purchases christmas http bit ly dzxksr
"Galaxy s6 Case, Tonsee Fresh Cute Flip Wallet Leather Case Cover for Samsung Galaxy S http:// amzn.to/2eYNsWw pic.twitter.com/8Ej5blCK1L","Galaxy s6 Case, Tonsee Fresh Cute Flip Wallet Leather Case Cover for Samsung Galaxy S http:// amzn.to/2eYNsWw pic.twitter.com/8Ej5blCK1L",galaxy s case tonsee fresh cute flip wallet leather case cover for samsung galaxy s http amzn to eynsww pic twitter com ej blck l,galaxy case tonsee fresh cute flip wallet leather case cover samsung galaxy http amzn eynsww pic twitter com ej blck 
Samsung Galaxy Note 8 si far?: con 8 GB di RAM a 15 nanometri? http:// fb.me/2HYI4ABaw,Samsung Galaxy Note 8 si far?: con 8 GB di RAM a 15 nanometri? http:// fb.me/2HYI4ABaw,samsung galaxy note  si far con  gb di ram a  nanometri http fb me hyi abaw,samsung galaxy note  si far  gb di ram  nanometri http fb hyi abaw
Engadget Japanese? ???Fisker?EV??????? EMotion???????????????4?????????????????? http:// dlvr.it/MZNs6x,Engadget Japanese? ???Fisker?EV??????? EMotion???????????????4?????????????????? http:// dlvr.it/MZNs6x,engadget japanese  fisker ev emotion http dlvr it mzns x,engadget japanese  fisker ev emotion http dlvr mzns 
The Samsung Galaxy S8 could be mostly screen - CNET http:// dlvr.it/MZNs3p via @RareDivergent pic.twitter.com/JgeMPm5QOb,The Samsung Galaxy S8 could be mostly screen - CNET http:// dlvr.it/MZNs3p via @RareDivergent pic.twitter.com/JgeMPm5QOb,the samsung galaxy s could be mostly screen  cnet http dlvr it mzns p via raredivergent pic twitter com jgempm qob, samsung galaxy screen  cnet http dlvr mzns raredivergent pic twitter com jgempm qob
The Samsung Galaxy S8 could be mostly screen - CNET: A recent Korean report suggests that the front of the next? http:// dlvr.it/MZNrzs pic.twitter.com/gWIDGSotJe,The Samsung Galaxy S8 could be mostly screen - CNET: A recent Korean report suggests that the front of the next? http:// dlvr.it/MZNrzs pic.twitter.com/gWIDGSotJe,the samsung galaxy s could be mostly screen  cnet a recent korean report suggests that the front of the next http dlvr it mznrzs pic twitter com gwidgsotje, samsung galaxy screen  cnet recent korean report suggests http dlvr mznrzs pic twitter com gwidgsotje
Engadget Japanese? Apple Pay????????????????AI???????????????? http:// dlvr.it/MZNryW,Engadget Japanese? Apple Pay????????????????AI???????????????? http:// dlvr.it/MZNryW,engadget japanese apple pay ai http dlvr it mznryw,engadget japanese apple pay ai http dlvr mznryw
Samsung is focused on the Galaxy S8 and is already promising discounts to loyal users http:// goo.gl/Dcy6F3 via @jawadabbi,Samsung is focused on the Galaxy S8 and is already promising discounts to loyal users http:// goo.gl/Dcy6F3 via @jawadabbi,samsung is focused on the galaxy s and is already promising discounts to loyal users http goo gl dcy f via jawadabbi,samsung focused galaxy promising discounts loyal users http goo gl dcy jawadabbi
Samsung et LG ? couteaux tir?s pour la production de l??cran OLED de l?iPhone 8 (via @iPhoneAddictFr ) http:// iphoneaddict.fr/post/news-1923 07-samsung-lg-couteaux-tires-production-lecran-oled-liphone-8 ?,Samsung et LG ? couteaux tir?s pour la production de l??cran OLED de l?iPhone 8 (via @iPhoneAddictFr ) http:// iphoneaddict.fr/post/news-1923 07-samsung-lg-couteaux-tires-production-lecran-oled-liphone-8 ?,samsung et lg  couteaux tir s pour la production de l cran oled de l iphone  via iphoneaddictfr  http iphoneaddict fr post news  samsung lg couteaux tires production lecran oled liphone,samsung et lg  couteaux tir pour la production cran oled iphone  iphoneaddictfr  http iphoneaddict fr post news  samsung lg couteaux tires production lecran oled liphone
Samsung UN32J5205AFXZA 32-Inch 1080p LED TV LED J5205#win RT & Follow pic.twitter.com/72n4sK3R3O,Samsung UN32J5205AFXZA 32-Inch 1080p LED TV LED J5205#win RT & Follow pic.twitter.com/72n4sK3R3O,samsung un j afxza inch p led tv led j win rt  follow pic twitter com n sk r o,samsung afxza inch led tv led win rt  follow pic twitter com sk 
Samsung Electronic ??????????? $1 ???? ? ???????????? ????? https:// goo.gl/fb/MkuYfg,Samsung Electronic ??????????? $1 ???? ? ???????????? ????? https:// goo.gl/fb/MkuYfg,samsung electronic       https goo gl fb mkuyfg,samsung electronic       https goo gl fb mkuyfg
What Will Samsung Do With Its 4.3 Million Recalled Smartphones? #greenpeace http://www. ecowatch.com/samsung-galaxy -note-7-recall-2074171431.html?utm_source=EcoWatch+List&utm_campaign=24fd7f44ed-MailChimp+Email+Blast&utm_medium=email&utm_term=0_49c7d43dc9-24fd7f44ed-86072005 ?,What Will Samsung Do With Its 4.3 Million Recalled Smartphones? #greenpeace http://www. ecowatch.com/samsung-galaxy -note-7-recall-2074171431.html?utm_source=EcoWatch+List&utm_campaign=24fd7f44ed-MailChimp+Email+Blast&utm_medium=email&utm_term=0_49c7d43dc9-24fd7f44ed-86072005 ?,what will samsung do with its  million recalled smartphones  greenpeace http www ecowatch com samsung galaxy note recall html utm_source ecowatch list utm_campaign fd f ed mailchimp email blast utm_medium email utm_term _ c d dc fd f ed, samsung  million recalled smartphones  greenpeace http www ecowatch com samsung galaxy note recall html utm_source ecowatch list utm_campaign fd ed mailchimp email blast utm_medium email utm_term _ dc fd ed
"Samsung CEO'sundan Note 7 a??klamas? Samsung , d?zenledi?i ola?an?st? kongresinde konu?an S? http:// ift.tt/2fsM3LT pic.twitter.com/M4gkmkG1dU","Samsung CEO'sundan Note 7 a??klamas? Samsung , d?zenledi?i ola?an?st? kongresinde konu?an S? http:// ift.tt/2fsM3LT pic.twitter.com/M4gkmkG1dU",samsung ceo sundan note  a klamas samsung  d zenledi i ola an st kongresinde konu an s http ift tt fsm lt pic twitter com m gkmkg du,samsung ceo sundan note  klamas samsung  zenledi ola st kongresinde konu http ift tt fsm lt pic twitter com gkmkg du
Samsung 1500 ????????? ??????? ??????? ???????? https:// goo.gl/S49qxX pic.twitter.com/kkENNyql8t,Samsung 1500 ????????? ??????? ??????? ???????? https:// goo.gl/S49qxX pic.twitter.com/kkENNyql8t,samsung      https goo gl s qxx pic twitter com kkennyql t,samsung      https goo gl qxx pic twitter com kkennyql 
The Samsung Galaxy S8 could be mostly screen - CNET: A recent Korean report suggests that? http:// bit.ly/2fsJRUU | http:// cnet.com,The Samsung Galaxy S8 could be mostly screen - CNET: A recent Korean report suggests that? http:// bit.ly/2fsJRUU | http:// cnet.com,the samsung galaxy s could be mostly screen  cnet a recent korean report suggests that http bit ly fsjruu | http cnet com, samsung galaxy screen  cnet recent korean report suggests http bit ly fsjruu | http cnet com
Avrupa: Samsung mu iphone mu? Afrika: Ekmek mi su mu? Orta Do?u: Ya?amak m? ?lmek mi?,Avrupa: Samsung mu iphone mu? Afrika: Ekmek mi su mu? Orta Do?u: Ya?amak m? ?lmek mi?,avrupa samsung mu iphone mu afrika ekmek mi su mu orta do u ya amak m  lmek mi,avrupa samsung mu iphone mu afrika ekmek mi su mu orta ya amak  lmek mi
"Pedro @sanchezcastejon pidi? ayuda a Telef?nica y le regalaron un Samsung Galaxy Note 7. Con tarifa plana incluida, que todo hay que decirlo","Pedro @sanchezcastejon pidi? ayuda a Telef?nica y le regalaron un Samsung Galaxy Note 7. Con tarifa plana incluida, que todo hay que decirlo",pedro sanchezcastejon pidi ayuda a telef nica y le regalaron un samsung galaxy note  con tarifa plana incluida que todo hay que decirlo,pedro sanchezcastejon pidi ayuda telef nica le regalaron samsung galaxy note  tarifa plana incluida que todo hay que decirlo
Amazon tablet shipments grow 319% but Samsung and Apple dominate a declining market - CNBC https:// apple.news/AdnL-T508R7eWW RBFudTo2g ?,Amazon tablet shipments grow 319% but Samsung and Apple dominate a declining market - CNBC https:// apple.news/AdnL-T508R7eWW RBFudTo2g ?,amazon tablet shipments grow  but samsung and apple dominate a declining market  cnbc https apple news adnl t r eww rbfudto g,amazon tablet shipments grow  samsung apple dominate declining market  cnbc https apple news adnl eww rbfudto 
Another #Happy Customer unlocked a #Samsung #I337M at #SRS Server..,Another #Happy Customer unlocked a #Samsung #I337M at #SRS Server..,another happy customer unlocked a samsung i m at srs server, happy customer unlocked samsung srs server
Venez jouer au jeu : Gagnez un casque Samsung Gear VR ! du Club Metro http:// ln.is/clubmetro.lci. fr/qui/2wSvu ?,Venez jouer au jeu : Gagnez un casque Samsung Gear VR ! du Club Metro http:// ln.is/clubmetro.lci. fr/qui/2wSvu ?,venez jouer au jeu  gagnez un casque samsung gear vr  du club metro http ln is clubmetro lci fr qui wsvu,venez jouer au jeu  gagnez casque samsung gear vr  du club metro http ln clubmetro lci fr qui wsvu
ca fait grave longtemps qu'on s'est pas parl? nous mais tu m'as d?j? saoul? avec ton emoji Samsung ptdrr,ca fait grave longtemps qu'on s'est pas parl? nous mais tu m'as d?j? saoul? avec ton emoji Samsung ptdrr,ca fait grave longtemps qu on s est pas parl nous mais tu m as d j saoul avec ton emoji samsung ptdrr,ca fait grave longtemps qu est pas parl nous mais tu saoul avec ton emoji samsung ptdrr
"Participa! SORTEO INTERNACIONAL | Samsung Galaxy S7 Dorado de @DonAndroidWeb , ?como participar? Ve el video https:// youtu.be/te0Fp-BOmTg","Participa! SORTEO INTERNACIONAL | Samsung Galaxy S7 Dorado de @DonAndroidWeb , ?como participar? Ve el video https:// youtu.be/te0Fp-BOmTg",participa sorteo internacional | samsung galaxy s dorado de donandroidweb  como participar ve el video https youtu be te fp bomtg,participa sorteo internacional | samsung galaxy dorado donandroidweb  como participar ve el video https youtu te fp bomtg
