Tweets,Tweet,Tweet2,Tweet3
Canada is the only country to refuse Note 7 refunds. USA and China allow it. @Samsung @CBC @CTVNews @cbctanya @globeandmail @torontostar https:// twitter.com/adamnucks/stat us/793594610320744449 ?,Canada is the only country to refuse Note 7 refunds. USA and China allow it. @Samsung @CBC @CTVNews @cbctanya @globeandmail @torontostar https:// twitter.com/adamnucks/stat us/793594610320744449 ?,canada is the only country to refuse note  refunds usa and china allow it  samsung cbc ctvnews cbctanya globeandmail torontostar https twitter com adamnucks stat us,canada country refuse note  refunds usa china allow  samsung cbc ctvnews cbctanya globeandmail torontostar https twitter com adamnucks stat 
"Ricardo Eletro - Smart Tv Led 55"" Samsung Uhd Premium 4k, Hdr Premium, One Control - R$4.029,73 Em At?... http://www. promoforum.com.br/topicos/smart- tv-led-55-samsung-uhd-premium-4k-hdr-premium-one-control-r-4-029-73-em-ate-10x.60473/ ?","Ricardo Eletro - Smart Tv Led 55"" Samsung Uhd Premium 4k, Hdr Premium, One Control - R$4.029,73 Em At?... http://www. promoforum.com.br/topicos/smart- tv-led-55-samsung-uhd-premium-4k-hdr-premium-one-control-r-4-029-73-em-ate-10x.60473/ ?","ricardo eletro  smart tv led "" samsung uhd premium k hdr premium one control  r em at http www promoforum com br topicos smart tv led samsung uhd premium k hdr premium one control r em ate x","ricardo eletro  smart tv led "" samsung uhd premium hdr premium control  em http www promoforum com br topicos smart tv led samsung uhd premium hdr premium control em ate "
"Participa en el SORTEO INTERNACIONAL | Samsung Galaxy S7 Dorado , para saber como participar ver este video https:// wn.nr/jmWEwV","Participa en el SORTEO INTERNACIONAL | Samsung Galaxy S7 Dorado , para saber como participar ver este video https:// wn.nr/jmWEwV",participa en el sorteo internacional | samsung galaxy s dorado  para saber como participar ver este video https wn nr jmwewv,participa en el sorteo internacional | samsung galaxy dorado  para saber como participar ver este video https wn nr jmwewv
Red Shoes Heels Pumps Snap On Hard Protective Case for Samsung Galaxy S3 - Black http:// amzn.to/2eYXTcr pic.twitter.com/gaNj6LcAVM,Red Shoes Heels Pumps Snap On Hard Protective Case for Samsung Galaxy S3 - Black http:// amzn.to/2eYXTcr pic.twitter.com/gaNj6LcAVM,red shoes heels pumps snap on hard protective case for samsung galaxy s  black http amzn to eyxtcr pic twitter com ganj lcavm,red shoes heels pumps snap hard protective case samsung galaxy  black http amzn eyxtcr pic twitter com ganj lcavm
@Lucy_nee_chan mirar? Samsung seguro,@Lucy_nee_chan mirar? Samsung seguro,lucy_nee_chan mirar samsung seguro,lucy_nee_chan mirar samsung seguro
samsung galaxy ring black virgin mobile pl17242sphm840ua http:// phones.rainfall.com/store/samsung- galaxy-ring-black-virgin-mobile-pl1-7242-sph-m840-ua-inc739ca398f60ae72.html ? pic.twitter.com/MNNrLBYeCg,samsung galaxy ring black virgin mobile pl17242sphm840ua http:// phones.rainfall.com/store/samsung- galaxy-ring-black-virgin-mobile-pl1-7242-sph-m840-ua-inc739ca398f60ae72.html ? pic.twitter.com/MNNrLBYeCg,samsung galaxy ring black virgin mobile pl sphm ua http phones rainfall com store samsung galaxy ring black virgin mobile pl sph m ua inc ca f ae html  pic twitter com mnnrlbyecg,samsung galaxy ring black virgin mobile pl sphm ua http phones rainfall com store samsung galaxy ring black virgin mobile pl sph ua ca ae html  pic twitter com mnnrlbyecg
samsung galaxy s4 active i537 dive blue att unlocked car charger bundle http:// phones.rainfall.com/store/samsung- galaxy-s4-active-i537-dive-blue-att-unlocked--car-charger-bundle-inec2ddbd70cd1dbf3.html ? pic.twitter.com/D4TTd6JYDQ,samsung galaxy s4 active i537 dive blue att unlocked car charger bundle http:// phones.rainfall.com/store/samsung- galaxy-s4-active-i537-dive-blue-att-unlocked--car-charger-bundle-inec2ddbd70cd1dbf3.html ? pic.twitter.com/D4TTd6JYDQ,samsung galaxy s active i dive blue att unlocked car charger bundle http phones rainfall com store samsung galaxy s active i dive blue att unlocked car charger bundle inec ddbd cd dbf html  pic twitter com d ttd jydq,samsung galaxy active dive blue att unlocked car charger bundle http phones rainfall com store samsung galaxy active dive blue att unlocked car charger bundle inec ddbd cd dbf html  pic twitter com ttd jydq
"Smart TV LED 55"" Samsung UHD Premium 4K, HDR Premium, One Control, Conte?do Smart 4K, Plataforma Tizen,... http:// fb.me/86VRCJBE0","Smart TV LED 55"" Samsung UHD Premium 4K, HDR Premium, One Control, Conte?do Smart 4K, Plataforma Tizen,... http:// fb.me/86VRCJBE0","smart tv led "" samsung uhd premium k hdr premium one control conte do smart k plataforma tizen http fb me vrcjbe","smart tv led "" samsung uhd premium hdr premium control conte smart plataforma tizen http fb vrcjbe"
samsung galaxy note 4 n910t 32gb 4g verizon smartphone white broken bb23915 http:// phones.rainfall.com/store/samsung- galaxy-note-4-n910t-32gb-4g-verizon-smartphone-white-broken-bb23915-in508abbcdf1ddf960.html ? pic.twitter.com/abzSZlrQC9,samsung galaxy note 4 n910t 32gb 4g verizon smartphone white broken bb23915 http:// phones.rainfall.com/store/samsung- galaxy-note-4-n910t-32gb-4g-verizon-smartphone-white-broken-bb23915-in508abbcdf1ddf960.html ? pic.twitter.com/abzSZlrQC9,samsung galaxy note  n t gb g verizon smartphone white broken bb http phones rainfall com store samsung galaxy note n t gb g verizon smartphone white broken bb in abbcdf ddf html  pic twitter com abzszlrqc,samsung galaxy note  gb verizon smartphone white broken bb http phones rainfall com store samsung galaxy note gb verizon smartphone white broken bb abbcdf ddf html  pic twitter com abzszlrqc
????????? samsung pc studio 3 ?? ????? ?????????? http:// polynesiaforum.ru/showforum/3/pr ogrammu-samsung-pc-studio-3-so-vsemi-drayverami/ ? #BQ #??????? #?????,????????? samsung pc studio 3 ?? ????? ?????????? http:// polynesiaforum.ru/showforum/3/pr ogrammu-samsung-pc-studio-3-so-vsemi-drayverami/ ? #BQ #??????? #?????, samsung pc studio     http polynesiaforum ru showforum pr ogrammu samsung pc studio so vsemi drayverami   bq, samsung pc studio     http polynesiaforum ru showforum pr ogrammu samsung pc studio vsemi drayverami   bq
#LanaDelRey #iPhone Lana Del Rey Collage Beauty New iPhone 4 5 6 6s #Samsung #Galaxy S6 S7 Hard #Case http:// dlvr.it/MZPptp #eBay #Auction pic.twitter.com/4BstCdIBzX,#LanaDelRey #iPhone Lana Del Rey Collage Beauty New iPhone 4 5 6 6s #Samsung #Galaxy S6 S7 Hard #Case http:// dlvr.it/MZPptp #eBay #Auction pic.twitter.com/4BstCdIBzX,lanadelrey iphone lana del rey collage beauty new iphone    s samsung galaxy s s hard case http dlvr it mzpptp ebay auction pic twitter com bstcdibzx,lanadelrey iphone lana del rey collage beauty new iphone    samsung galaxy s hard case http dlvr mzpptp ebay auction pic twitter com bstcdibzx
"Samsung UE40JU6072U 40"" 4K Ultra HD Smart TV... baja un -25% y se queda en 705 ?. (-235.10 ?) http://www. amazon.es/gp/aws/cart/ad d.html?AssociateTag=oposicionesti-21&ASIN.1=B017YXJ3TY&Quantity.1=1 ? pic.twitter.com/UL4fBp4ib7","Samsung UE40JU6072U 40"" 4K Ultra HD Smart TV... baja un -25% y se queda en 705 ?. (-235.10 ?) http://www. amazon.es/gp/aws/cart/ad d.html?AssociateTag=oposicionesti-21&ASIN.1=B017YXJ3TY&Quantity.1=1 ? pic.twitter.com/UL4fBp4ib7","samsung ue ju u "" k ultra hd smart tv baja un  y se queda en     http www amazon es gp aws cart ad d html associatetag oposicionesti asin b yxj ty quantity  pic twitter com ul fbp ib","samsung ue ju "" ultra hd smart tv baja  se queda en     http www amazon es gp aws cart ad html associatetag oposicionesti asin yxj ty quantity  pic twitter com ul fbp ib"
"With NYT?s new The Daily 360, Samsung looks to jumpstart everyday VR http:// tcrn.ch/2f9KGyC @techcrunch ??","With NYT?s new The Daily 360, Samsung looks to jumpstart everyday VR http:// tcrn.ch/2f9KGyC @techcrunch ??",with nyt s new the daily  samsung looks to jumpstart everyday vr http tcrn ch f kgyc techcrunch, nyt new daily  samsung looks jumpstart everyday vr http tcrn ch kgyc techcrunch
hre2e l samsung ya jehle,hre2e l samsung ya jehle,hre e l samsung ya jehle,hre samsung ya jehle
@ErisNyxAlt Only cause Samsung did it first. pic.twitter.com/AKYELAIvgP,@ErisNyxAlt Only cause Samsung did it first. pic.twitter.com/AKYELAIvgP,erisnyxalt only cause samsung did it first pic twitter com akyelaivgp,erisnyxalt cause samsung did pic twitter com akyelaivgp
I liked a @YouTube video from @mruczkaxx http:// youtu.be/6B4JfMb__5A?a Samsung Galaxy S7 (Exynos) - Spider-Man 3 - PPSSPP v1.3.0.1 - Test,I liked a @YouTube video from @mruczkaxx http:// youtu.be/6B4JfMb__5A?a Samsung Galaxy S7 (Exynos) - Spider-Man 3 - PPSSPP v1.3.0.1 - Test,i liked a youtube video from mruczkaxx http youtu be b jfmb__ a a samsung galaxy s  exynos  spider man   ppsspp v  test, liked youtube video mruczkaxx http youtu jfmb__ a samsung galaxy  exynos  spider man   ppsspp  test
For Samsung Galaxy Note 3 N900A Back Battery Door Cover Reae Case Cover Repla ... http:// aliexclusives.com/products/for-s amsung-galaxy-note-3-n900a-back-battery-door-cover-reae-case-cover-replacement-part-white/ ? pic.twitter.com/WhnscANd8q,For Samsung Galaxy Note 3 N900A Back Battery Door Cover Reae Case Cover Repla ... http:// aliexclusives.com/products/for-s amsung-galaxy-note-3-n900a-back-battery-door-cover-reae-case-cover-replacement-part-white/ ? pic.twitter.com/WhnscANd8q,for samsung galaxy note  n a back battery door cover reae case cover repla  http aliexclusives com products for s amsung galaxy note n a back battery door cover reae case cover replacement part white  pic twitter com whnscand q, samsung galaxy note  battery door cover reae case cover repla  http aliexclusives com products amsung galaxy note battery door cover reae case cover replacement white  pic twitter com whnscand 
"Ooh, I was just discussing Samsung 's next move with my clients and here it is https:// twitter.com/samsungph/stat us/792339120399888384 ?","Ooh, I was just discussing Samsung 's next move with my clients and here it is https:// twitter.com/samsungph/stat us/792339120399888384 ?",ooh i was just discussing samsung s next move with my clients and here it is https twitter com samsungph stat us,ooh just discussing samsung clients https twitter com samsungph stat 
@livelovelike555 @Apple Why I have always been Samsung .,@livelovelike555 @Apple Why I have always been Samsung .,livelovelike  apple why i have always been samsung,livelovelike  apple samsung
I entered to win an iPhone7 or Samsung Galaxy S7 Edge from @MountainAmerica and you can too! Click here: http:// woobox.com/d5nf75/i2bh60,I entered to win an iPhone7 or Samsung Galaxy S7 Edge from @MountainAmerica and you can too! Click here: http:// woobox.com/d5nf75/i2bh60,i entered to win an iphone or samsung galaxy s edge from mountainamerica and you can too click here http woobox com d nf i bh, entered win iphone samsung galaxy edge mountainamerica click http woobox com nf bh
"Adicionei um v?deo a uma playlist @YouTube http:// youtu.be/62r600OCloc?aC omo ? Desmontar Samsung Galaxy J7 SM J700, J700M, J700H, Metal","Adicionei um v?deo a uma playlist @YouTube http:// youtu.be/62r600OCloc?aC omo ? Desmontar Samsung Galaxy J7 SM J700, J700M, J700H, Metal",adicionei um v deo a uma playlist youtube http youtu be r ocloc ac omo  desmontar samsung galaxy j sm j j m j h metal,adicionei um deo uma playlist youtube http youtu ocloc ac omo  desmontar samsung galaxy sm j metal
"JAJAJAAJ LLORO EL CAPITAN DIJO ""QUEDA TERMINANTEMENTE PROHIBIDO TRANSPORTAR EL DISPOSITIVO SAMSUNG GALAXY NOTE 7"" @SamsungArg perd?n","JAJAJAAJ LLORO EL CAPITAN DIJO ""QUEDA TERMINANTEMENTE PROHIBIDO TRANSPORTAR EL DISPOSITIVO SAMSUNG GALAXY NOTE 7"" @SamsungArg perd?n","jajajaaj lloro el capitan dijo ""queda terminantemente prohibido transportar el dispositivo samsung galaxy note "" samsungarg perd n","jajajaaj lloro el capitan dijo ""queda terminantemente prohibido transportar el dispositivo samsung galaxy note "" samsungarg perd "
#?ahinimolsa satar yerine samsung galaxy s7 edge plus 128 gb alirdim...,#?ahinimolsa satar yerine samsung galaxy s7 edge plus 128 gb alirdim...,ahinimolsa satar yerine samsung galaxy s edge plus  gb alirdim,ahinimolsa satar yerine samsung galaxy edge plus  gb alirdim
Lista de los primeros dispositivos Samsung que recibir?n Android 6.0 Marshmallow - http:// mundogadget.net/2015/11/lista- de-los-primeros-dispositivos-samsung-que-recibiran-android-6-0-marshmallow.html ?,Lista de los primeros dispositivos Samsung que recibir?n Android 6.0 Marshmallow - http:// mundogadget.net/2015/11/lista- de-los-primeros-dispositivos-samsung-que-recibiran-android-6-0-marshmallow.html ?,lista de los primeros dispositivos samsung que recibir n android  marshmallow  http mundogadget net lista de los primeros dispositivos samsung que recibiran android marshmallow html,lista los primeros dispositivos samsung que recibir android  marshmallow  http mundogadget net lista los primeros dispositivos samsung que recibiran android marshmallow html
#fragtinka Warum haben Samsung Phones bessere Leistungen als IPhones?,#fragtinka Warum haben Samsung Phones bessere Leistungen als IPhones?,fragtinka warum haben samsung phones bessere leistungen als iphones,fragtinka warum haben samsung phones bessere leistungen als iphones
"Samsung Chromebook 3 XE500C13-K02US 4 GB RAM 16GB SSD 11.6"" Laptop (Black) - http:// amzn.to/2ffeNTH #Tech #Deals pic.twitter.com/hHJzUA8G3z","Samsung Chromebook 3 XE500C13-K02US 4 GB RAM 16GB SSD 11.6"" Laptop (Black) - http:// amzn.to/2ffeNTH #Tech #Deals pic.twitter.com/hHJzUA8G3z","samsung chromebook  xe c k us  gb ram gb ssd "" laptop black  http amzn to ffenth tech deals pic twitter com hhjzua g z","samsung chromebook  xe  gb ram gb ssd "" laptop black  http amzn ffenth tech deals pic twitter com hhjzua "
"Samsung Electronics CEO: ""We have a long history of overcoming crises"" http://www. bbc.com.np/30c pic.twitter.com/KSBQYttCgW","Samsung Electronics CEO: ""We have a long history of overcoming crises"" http://www. bbc.com.np/30c pic.twitter.com/KSBQYttCgW","samsung electronics ceo ""we have a long history of overcoming crises"" http www bbc com np c pic twitter com ksbqyttcgw","samsung electronics ceo ""we long history overcoming crises"" http www bbc com np pic twitter com ksbqyttcgw"
"Participa! SORTEO INTERNACIONAL | Samsung Galaxy S7 Dorado de @DonAndroidWeb , ?como participar? Ve el video https:// youtu.be/te0Fp-BOmTg","Participa! SORTEO INTERNACIONAL | Samsung Galaxy S7 Dorado de @DonAndroidWeb , ?como participar? Ve el video https:// youtu.be/te0Fp-BOmTg",participa sorteo internacional | samsung galaxy s dorado de donandroidweb  como participar ve el video https youtu be te fp bomtg,participa sorteo internacional | samsung galaxy dorado donandroidweb  como participar ve el video https youtu te fp bomtg
Companhias a?reas pro?bem a entrada do Samsung Galaxy Note 7 em seus voos http://www. embarquenaviagem.com/2016/10/17/sam sung-galaxy-note-7/ ?,Companhias a?reas pro?bem a entrada do Samsung Galaxy Note 7 em seus voos http://www. embarquenaviagem.com/2016/10/17/sam sung-galaxy-note-7/ ?,companhias a reas pro bem a entrada do samsung galaxy note  em seus voos http www embarquenaviagem com sam sung galaxy note,companhias reas pro bem entrada samsung galaxy note  em seus voos http www embarquenaviagem com sam sung galaxy note
"Smart TV LED 55"" Samsung UHD 4K Curva, HDR Premium, Conte?do Smart 4K, Plataforma Tizen, Controle Smart,... http:// fb.me/8pk4fb2fu","Smart TV LED 55"" Samsung UHD 4K Curva, HDR Premium, Conte?do Smart 4K, Plataforma Tizen, Controle Smart,... http:// fb.me/8pk4fb2fu","smart tv led "" samsung uhd k curva hdr premium conte do smart k plataforma tizen controle smart http fb me pk fb fu","smart tv led "" samsung uhd curva hdr premium conte smart plataforma tizen controle smart http fb pk fb fu"
Emperor Penguin is a Father Stands by Chick Samsung Galaxy S7 Case $38.65 by comfortmelody ]]> http:// dlvr.it/MZPmh8 pic.twitter.com/eQTDGoMth4,Emperor Penguin is a Father Stands by Chick Samsung Galaxy S7 Case $38.65 by comfortmelody ]]> http:// dlvr.it/MZPmh8 pic.twitter.com/eQTDGoMth4,emperor penguin is a father stands by chick samsung galaxy s case  by comfortmelody  http dlvr it mzpmh pic twitter com eqtdgomth,emperor penguin father stands chick samsung galaxy case  comfortmelody  http dlvr mzpmh pic twitter com eqtdgomth
@jamessmk The only time their stock goes up is when Samsung fucks up... lol,@jamessmk The only time their stock goes up is when Samsung fucks up... lol,jamessmk the only time their stock goes up is when samsung fucks up lol,jamessmk time stock goes samsung fucks lol
"Ricardo Eletro - Smart Tv Led 55"" Samsung Uhd 4k Curva, Hdr Premium, Conte?do Smart 4k - R$3.843,10 Em... http://www. promoforum.com.br/topicos/smart- tv-led-55-samsung-uhd-4k-curva-hdr-premium-conteudo-smart-4k-r-3-843-10-em-ate-10x.60472/ ?","Ricardo Eletro - Smart Tv Led 55"" Samsung Uhd 4k Curva, Hdr Premium, Conte?do Smart 4k - R$3.843,10 Em... http://www. promoforum.com.br/topicos/smart- tv-led-55-samsung-uhd-4k-curva-hdr-premium-conteudo-smart-4k-r-3-843-10-em-ate-10x.60472/ ?","ricardo eletro  smart tv led "" samsung uhd k curva hdr premium conte do smart k  r em http www promoforum com br topicos smart tv led samsung uhd k curva hdr premium conteudo smart k r em ate x","ricardo eletro  smart tv led "" samsung uhd curva hdr premium conte smart  em http www promoforum com br topicos smart tv led samsung uhd curva hdr premium conteudo smart em ate "
Samsung ?s new startups include a wearable 360 cam and a humming app http:// upflow.co/l/4dDa,Samsung ?s new startups include a wearable 360 cam and a humming app http:// upflow.co/l/4dDa,samsung s new startups include a wearable  cam and a humming app http upflow co l dda,samsung new startups include wearable  cam humming app http upflow dda
the irony is i will talking about how samsung phones offers its users to use encryption but iPhone doesn't and i myself own iphone YOLO MOFO,the irony is i will talking about how samsung phones offers its users to use encryption but iPhone doesn't and i myself own iphone YOLO MOFO,the irony is i will talking about how samsung phones offers its users to use encryption but iphone doesn t and i myself own iphone yolo mofo, irony talking samsung phones offers users use encryption iphone doesn iphone yolo mofo
"fone da samsung por 9,90...n resisti, comprei dois","fone da samsung por 9,90...n resisti, comprei dois",fone da samsung por n resisti comprei dois,fone da samsung por resisti comprei dois
RESTRICTED approval for Sectra and Samsung secure smartphone partnership https:// lnkd.in/ejvyvpd,RESTRICTED approval for Sectra and Samsung secure smartphone partnership https:// lnkd.in/ejvyvpd,restricted approval for sectra and samsung secure smartphone partnership https lnkd in ejvyvpd,restricted approval sectra samsung secure smartphone partnership https lnkd ejvyvpd
"Dapetin hadiah utama ke Thailand , Hp Samsung atau puluhan Voucher belanja. Struk tetap disimpan yaa @Vicee_ID #ViceeFunTanpaSariawan pic.twitter.com/Gsa5icGDwG","Dapetin hadiah utama ke Thailand , Hp Samsung atau puluhan Voucher belanja. Struk tetap disimpan yaa @Vicee_ID #ViceeFunTanpaSariawan pic.twitter.com/Gsa5icGDwG",dapetin hadiah utama ke thailand  hp samsung atau puluhan voucher belanja struk tetap disimpan yaa vicee_id viceefuntanpasariawan pic twitter com gsa icgdwg,dapetin hadiah utama ke thailand  hp samsung atau puluhan voucher belanja struk tetap disimpan yaa vicee_id viceefuntanpasariawan pic twitter com gsa icgdwg
"Mon pere i s'est achet? l'iPhone 7plus et i me dit ""bof jvois pas de diff?rence avec le Samsung "" Oh my god","Mon pere i s'est achet? l'iPhone 7plus et i me dit ""bof jvois pas de diff?rence avec le Samsung "" Oh my god","mon pere i s est achet l iphone plus et i me dit ""bof jvois pas de diff rence avec le samsung "" oh my god","mon pere est achet iphone plus et dit ""bof jvois pas diff rence avec le samsung "" oh god"
"Samsung Galaxy Tab A 10"" 16GB Android Tablet for $199 + free shipping - http:// dn.ws/131zz","Samsung Galaxy Tab A 10"" 16GB Android Tablet for $199 + free shipping - http:// dn.ws/131zz","samsung galaxy tab a "" gb android tablet for   free shipping  http dn ws zz","samsung galaxy tab "" gb android tablet   free shipping  http dn ws zz"
@BBCWorld @eddiecarmo Exploding Samsung ?,@BBCWorld @eddiecarmo Exploding Samsung ?,bbcworld eddiecarmo exploding samsung,bbcworld eddiecarmo exploding samsung
"Samsung UN26C4000 26"" 720p HD LED LCD Television hi tv via eBay http:// ift.tt/2ekYGGl ...","Samsung UN26C4000 26"" 720p HD LED LCD Television hi tv via eBay http:// ift.tt/2ekYGGl ...","samsung un c  "" p hd led lcd television hi tv via ebay http ift tt ekyggl","samsung  "" hd led lcd television hi tv ebay http ift tt ekyggl"
Get Samsung Galaxy s6 edge plus Tech accessories from me on #Vinted . Size for $ 400.0: http://www. vinted.com/accessories/te ch-accessories/21292969-samsung-galaxy-s6-edge-plus-gold-verizon-32gb ? pic.twitter.com/C5bhPyAWiy,Get Samsung Galaxy s6 edge plus Tech accessories from me on #Vinted . Size for $ 400.0: http://www. vinted.com/accessories/te ch-accessories/21292969-samsung-galaxy-s6-edge-plus-gold-verizon-32gb ? pic.twitter.com/C5bhPyAWiy,get samsung galaxy s edge plus tech accessories from me on vinted  size for   http www vinted com accessories te ch accessories samsung galaxy s edge plus gold verizon gb  pic twitter com c bhpyawiy, samsung galaxy edge plus tech accessories vinted  size   http www vinted com accessories te ch accessories samsung galaxy edge plus gold verizon gb  pic twitter com bhpyawiy
"Smartphone Samsung Galaxy On 7 Dual Chip 5.5"" 8GB 4G 13MP Dourado Por R$ 599,99 no boleto ou R$ 681,81 (10x): http:// goo.gl/NgJpOe pic.twitter.com/8Gc4dfBTY0","Smartphone Samsung Galaxy On 7 Dual Chip 5.5"" 8GB 4G 13MP Dourado Por R$ 599,99 no boleto ou R$ 681,81 (10x): http:// goo.gl/NgJpOe pic.twitter.com/8Gc4dfBTY0","smartphone samsung galaxy on  dual chip "" gb g mp dourado por r  no boleto ou r   x http goo gl ngjpoe pic twitter com gc dfbty","smartphone samsung galaxy  dual chip "" gb mp dourado por  boleto ou   http goo gl ngjpoe pic twitter com gc dfbty"
Limited on app marketing funds? #GamesForSamsung partners have seen 150K+ downloads without spending a cent. Swing by #Unite16 to learn more,Limited on app marketing funds? #GamesForSamsung partners have seen 150K+ downloads without spending a cent. Swing by #Unite16 to learn more,limited on app marketing funds  gamesforsamsung partners have seen k downloads without spending a cent swing by unite to learn more,limited app marketing funds  gamesforsamsung partners seen downloads spending cent swing unite learn 
@samsung _dev #Unite16 Quite nice program for game developers.,@samsung _dev #Unite16 Quite nice program for game developers.,samsung _dev unite quite nice program for game developers,samsung _dev unite quite nice program game developers
"Smart TV LED 49"" Samsung SUHD 4K com Pontos Qu?nticos, HDR 1000, Tizen, One control, Design 360? Ultra slim,... http:// fb.me/6KRZhp85o","Smart TV LED 49"" Samsung SUHD 4K com Pontos Qu?nticos, HDR 1000, Tizen, One control, Design 360? Ultra slim,... http:// fb.me/6KRZhp85o","smart tv led "" samsung suhd k com pontos qu nticos hdr  tizen one control design  ultra slim http fb me krzhp o","smart tv led "" samsung suhd com pontos qu nticos hdr  tizen control design  ultra slim http fb krzhp "
The great thing about samsung is you never know if the person left you on read or just did not check their phone. Id rather not know,The great thing about samsung is you never know if the person left you on read or just did not check their phone. Id rather not know,the great thing about samsung is you never know if the person left you on read or just did not check their phone id rather not know, great thing samsung know person left read just did check phone id know
Samsung To Ramp Up US Mobile Chip Production With $1 Billion Investment http:// ift.tt/2eSkwlq #TechTimes,Samsung To Ramp Up US Mobile Chip Production With $1 Billion Investment http:// ift.tt/2eSkwlq #TechTimes,samsung to ramp up us mobile chip production with  billion investment http ift tt eskwlq techtimes,samsung ramp mobile chip production  billion investment http ift tt eskwlq techtimes
"???????????????????????10?????1,800??????SAMSUNG?????????????? SAMSUNG ?????????????????? ????MADE IN PRC ?????????????????????????????????? pic.twitter.com/3x1ZWMaZ9I","???????????????????????10?????1,800??????SAMSUNG?????????????? SAMSUNG ?????????????????? ????MADE IN PRC ?????????????????????????????????? pic.twitter.com/3x1ZWMaZ9I",samsung samsung  made in prc  pic twitter com x zwmaz i,samsung samsung  prc  pic twitter com zwmaz 
"Housse rotative pour tablettes Samsung , avec ou sans accessoires, d?s 6,90? (jusqu'? 83% de r?duction): 6.90&euro;? http:// dlvr.it/MZPknF pic.twitter.com/o1RkJRE5Rn","Housse rotative pour tablettes Samsung , avec ou sans accessoires, d?s 6,90? (jusqu'? 83% de r?duction): 6.90&euro;? http:// dlvr.it/MZPknF pic.twitter.com/o1RkJRE5Rn",housse rotative pour tablettes samsung  avec ou sans accessoires d s  jusqu  de r duction  euro http dlvr it mzpknf pic twitter com o rkjre rn,housse rotative pour tablettes samsung  avec ou sans accessoires  jusqu  duction  euro http dlvr mzpknf pic twitter com rkjre rn
