Tweets,Tweet,Tweet2,Tweet3
?????????? ??????????? (Galerie) ?? Android Jelly Bean. Samsung Galaxy S3. http:// youtu.be/Su3TJtfWA0s,?????????? ??????????? (Galerie) ?? Android Jelly Bean. Samsung Galaxy S3. http:// youtu.be/Su3TJtfWA0s,  galerie  android jelly bean samsung galaxy s http youtu be su tjtfwa s,  galerie  android jelly bean samsung galaxy http youtu su tjtfwa 
Samsung Electronic ??????????? $1 ???? ? ???????????? ????? https:// goo.gl/fb/wR9bJU,Samsung Electronic ??????????? $1 ???? ? ???????????? ????? https:// goo.gl/fb/wR9bJU,samsung electronic       https goo gl fb wr bju,samsung electronic       https goo gl fb wr bju
"In Today's News - Nintendo, Google, Toshiba, Nidec, NetApp, and Samsung http:// eepurl.com/cmJKVT #SSD #HDD #Cloudstorage #Datacenter #AI","In Today's News - Nintendo, Google, Toshiba, Nidec, NetApp, and Samsung http:// eepurl.com/cmJKVT #SSD #HDD #Cloudstorage #Datacenter #AI",in today s news  nintendo google toshiba nidec netapp and samsung http eepurl com cmjkvt ssd hdd cloudstorage datacenter ai, today news  nintendo google toshiba nidec netapp samsung http eepurl com cmjkvt ssd hdd cloudstorage datacenter ai
Samsung still doesn't know why its Note 7 batteries failed | FierceWireless http://www. fiercewireless.com/wireless/samsu ng-still-doesn-t-know-why-its-note-7-batteries-failed ?,Samsung still doesn't know why its Note 7 batteries failed | FierceWireless http://www. fiercewireless.com/wireless/samsu ng-still-doesn-t-know-why-its-note-7-batteries-failed ?,samsung still doesn t know why its note  batteries failed | fiercewireless http www fiercewireless com wireless samsu ng still doesn t know why its note batteries failed,samsung doesn know note  batteries failed | fiercewireless http www fiercewireless com wireless samsu ng doesn know note batteries failed
J? tnh o Samsung s6,J? tnh o Samsung s6,j tnh o samsung s, tnh samsung 
Samsung ?s new startups include a wearable 360 cam and a humming app http:// upflow.co/l/1bAW,Samsung ?s new startups include a wearable 360 cam and a humming app http:// upflow.co/l/1bAW,samsung s new startups include a wearable  cam and a humming app http upflow co l baw,samsung new startups include wearable  cam humming app http upflow baw
http:// amzn.to/2bSpxdS Samsung Galaxy J7 / Samsung J7 (J 7) Compatible Charger With USB Cable 1 Meter - White(1)? pic.twitter.com/CCJOiFSLSV,http:// amzn.to/2bSpxdS Samsung Galaxy J7 / Samsung J7 (J 7) Compatible Charger With USB Cable 1 Meter - White(1)? pic.twitter.com/CCJOiFSLSV,http amzn to bspxds samsung galaxy j  samsung j  j  compatible charger with usb cable  meter  white pic twitter com ccjoifslsv,http amzn bspxds samsung galaxy  samsung   compatible charger usb cable  meter  white pic twitter com ccjoifslsv
New Arrival Leather Wallet Case Cover Purse Slot Protective Case for Samsung Galaxy S http:// amzn.to/2eYTE0I pic.twitter.com/j0cFFNDlu7,New Arrival Leather Wallet Case Cover Purse Slot Protective Case for Samsung Galaxy S http:// amzn.to/2eYTE0I pic.twitter.com/j0cFFNDlu7,new arrival leather wallet case cover purse slot protective case for samsung galaxy s http amzn to eyte i pic twitter com j cffndlu,new arrival leather wallet case cover purse slot protective case samsung galaxy http amzn eyte pic twitter com cffndlu
"Macbook Pro, la Touch Bar usa schermi OLED e componenti Samsung http:// ift.tt/2eYSH8j #apple #appstore #iphone #ipad","Macbook Pro, la Touch Bar usa schermi OLED e componenti Samsung http:// ift.tt/2eYSH8j #apple #appstore #iphone #ipad",macbook pro la touch bar usa schermi oled e componenti samsung http ift tt eysh j apple appstore iphone ipad,macbook pro la touch bar usa schermi oled componenti samsung http ift tt eysh apple appstore iphone ipad
Samsung Electronics Co Ltd WLAN Access Point (A3LWEA412H) http:// dlvr.it/MZPPQG,Samsung Electronics Co Ltd WLAN Access Point (A3LWEA412H) http:// dlvr.it/MZPPQG,samsung electronics co ltd wlan access point a lwea h http dlvr it mzppqg,samsung electronics wlan access point lwea http dlvr mzppqg
SAMSUNG GALAXY J5 2016 Dual SIM 4G J5108 WHITE 16GB WARRANTY Unlocked Phone http:// dlvr.it/MZPP62 pic.twitter.com/EgJVRrGei3,SAMSUNG GALAXY J5 2016 Dual SIM 4G J5108 WHITE 16GB WARRANTY Unlocked Phone http:// dlvr.it/MZPP62 pic.twitter.com/EgJVRrGei3,samsung galaxy j  dual sim g j white gb warranty unlocked phone http dlvr it mzpp pic twitter com egjvrrgei,samsung galaxy  dual sim white gb warranty unlocked phone http dlvr mzpp pic twitter com egjvrrgei
"Hi #UnlockMobilesOnline , many #thanks Follow The #Cloud #cloudunlock #cloudunlocker #apple #samsung #iphone #icloud https:// twitter.com/UnlockMobOnline","Hi #UnlockMobilesOnline , many #thanks Follow The #Cloud #cloudunlock #cloudunlocker #apple #samsung #iphone #icloud https:// twitter.com/UnlockMobOnline",hi unlockmobilesonline  many thanks follow the cloud cloudunlock cloudunlocker apple samsung iphone icloud https twitter com unlockmobonline,hi unlockmobilesonline  thanks follow cloud cloudunlock cloudunlocker apple samsung iphone icloud https twitter com unlockmobonline
Flight announcement: Galaxy Note S7 are not allowed to explode errr to be used on the plane #virginaustralia #GalaxyNote7 #samsung,Flight announcement: Galaxy Note S7 are not allowed to explode errr to be used on the plane #virginaustralia #GalaxyNote7 #samsung,flight announcement galaxy note s are not allowed to explode errr to be used on the plane virginaustralia galaxynote  samsung,flight announcement galaxy note allowed explode errr used plane virginaustralia galaxynote  samsung
"J'aime une vid?o @YouTube : ""Switching From iPhone 6 to Samsung S7 Edge | My Thoughts"" ? l'adresse http:// youtu.be/KWxYFp4gngE?a .","J'aime une vid?o @YouTube : ""Switching From iPhone 6 to Samsung S7 Edge | My Thoughts"" ? l'adresse http:// youtu.be/KWxYFp4gngE?a .","j aime une vid o youtube  ""switching from iphone  to samsung s edge | my thoughts""  l adresse http youtu be kwxyfp gnge a"," aime une vid youtube  ""switching iphone  samsung edge | thoughts""  adresse http youtu kwxyfp gnge "
"Manager - Samsung - Mountain View, CA: Korean language skills helpful, but not mandatory... http:// bit.ly/2f7IklS #korean #jobs #korea","Manager - Samsung - Mountain View, CA: Korean language skills helpful, but not mandatory... http:// bit.ly/2f7IklS #korean #jobs #korea",manager  samsung  mountain view ca korean language skills helpful but not mandatory http bit ly f ikls korean jobs korea,manager  samsung  mountain view ca korean language skills helpful mandatory http bit ly ikls korean jobs korea
"Finally, some good news for #Samsung ! No #GalaxyNote7s involved this time! #Flatulence2Fireball http://www. foxnews.com/health/2016/11 /01/hospital-report-blames-patients-fart-for-surgical-fire.html ?","Finally, some good news for #Samsung ! No #GalaxyNote7s involved this time! #Flatulence2Fireball http://www. foxnews.com/health/2016/11 /01/hospital-report-blames-patients-fart-for-surgical-fire.html ?",finally some good news for samsung  no galaxynote s involved this time  flatulence fireball http www foxnews com health  hospital report blames patients fart for surgical fire html,finally good news samsung  galaxynote involved time  flatulence fireball http www foxnews com health  hospital report blames patients fart surgical html
Samsung Galaxy A7 2016 - Review en espa?ol: http:// youtu.be/sTu6karh5d0?a v?a @YouTube,Samsung Galaxy A7 2016 - Review en espa?ol: http:// youtu.be/sTu6karh5d0?a v?a @YouTube,samsung galaxy a   review en espa ol http youtu be stu karh d a v a youtube,samsung galaxy   review en espa ol http youtu stu karh youtube
"SAMSUNG UE40H6670 TV 3D FHD TELEVISORE LED 40"" POLLICI WI FI SMART TV USB HDMI http:// dlvr.it/MZPNkP pic.twitter.com/j91N88yJkj","SAMSUNG UE40H6670 TV 3D FHD TELEVISORE LED 40"" POLLICI WI FI SMART TV USB HDMI http:// dlvr.it/MZPNkP pic.twitter.com/j91N88yJkj","samsung ue h tv d fhd televisore led "" pollici wi fi smart tv usb hdmi http dlvr it mzpnkp pic twitter com j n yjkj","samsung ue tv fhd televisore led "" pollici wi fi smart tv usb hdmi http dlvr mzpnkp pic twitter com yjkj"
Samsung s 3500-more gestalt secondary consideration: hKiGuPGF http:// dlvr.it/MZPNmH,Samsung s 3500-more gestalt secondary consideration: hKiGuPGF http:// dlvr.it/MZPNmH,samsung s more gestalt secondary consideration hkigupgf http dlvr it mzpnmh,samsung gestalt secondary consideration hkigupgf http dlvr mzpnmh
@tar_wiwi Hai Mau Samsung S7 gratis dari @UCBrowserIndo Yuk ikuti tantangan kuis #doctorstrangediucnews pic.twitter.com/MPA9c6YQ7N *6,@tar_wiwi Hai Mau Samsung S7 gratis dari @UCBrowserIndo Yuk ikuti tantangan kuis #doctorstrangediucnews pic.twitter.com/MPA9c6YQ7N *6,tar_wiwi hai mau samsung s gratis dari ucbrowserindo yuk ikuti tantangan kuis doctorstrangediucnews pic twitter com mpa c yq n,tar_wiwi hai mau samsung gratis dari ucbrowserindo yuk ikuti tantangan kuis doctorstrangediucnews pic twitter com mpa yq 
?????????????????????????????????????????????? http:// saigaijyouhou.com/blog-entry-140 24.html ?,?????????????????????????????????????????????? http:// saigaijyouhou.com/blog-entry-140 24.html ?, http saigaijyouhou com blog entry  html, http saigaijyouhou com blog entry  html
T?i ?? th?ch video http:// youtu.be/mm43jhqAGJk?a Samsung Galaxy Note 4 - H??ng d?n s? d?ng b?t S Pen tr?n @YouTube,T?i ?? th?ch video http:// youtu.be/mm43jhqAGJk?a Samsung Galaxy Note 4 - H??ng d?n s? d?ng b?t S Pen tr?n @YouTube,t i  th ch video http youtu be mm jhqagjk a samsung galaxy note   h ng d n s d ng b t s pen tr n youtube,  th ch video http youtu mm jhqagjk samsung galaxy note   ng ng pen tr youtube
Google other samsung unleashed their that is desktop pc: chromebox: lkRx http:// dlvr.it/MZPN14,Google other samsung unleashed their that is desktop pc: chromebox: lkRx http:// dlvr.it/MZPN14,google other samsung unleashed their that is desktop pc chromebox lkrx http dlvr it mzpn,google samsung unleashed desktop pc chromebox lkrx http dlvr mzpn
"Great deals on Samsung 11 Pin to 5 Pin Micro USB Adapter Cable ?3.84, from TVCables http://www. tvcables.co.uk/samsung-11-pin -to-5-pin-mhl-adapter ?","Great deals on Samsung 11 Pin to 5 Pin Micro USB Adapter Cable ?3.84, from TVCables http://www. tvcables.co.uk/samsung-11-pin -to-5-pin-mhl-adapter ?",great deals on samsung  pin to  pin micro usb adapter cable  from tvcables http www tvcables co uk samsung pin to pin mhl adapter,great deals samsung  pin  pin micro usb adapter cable  tvcables http www tvcables uk samsung pin pin mhl adapter
What Will Samsung Do With Its 4.3 Million Recalled Smartphones? via @EcoWatch http://www. ecowatch.com/samsung-galaxy -note-7-recall-2074171431.html ?,What Will Samsung Do With Its 4.3 Million Recalled Smartphones? via @EcoWatch http://www. ecowatch.com/samsung-galaxy -note-7-recall-2074171431.html ?,what will samsung do with its  million recalled smartphones via ecowatch http www ecowatch com samsung galaxy note recall html, samsung  million recalled smartphones ecowatch http www ecowatch com samsung galaxy note recall html
I'm entering to win a FREE Samsung Tablet thanks to @delmarvavoip #giveaway Enter for your chance to win: https:// goo.gl/yFMTgV,I'm entering to win a FREE Samsung Tablet thanks to @delmarvavoip #giveaway Enter for your chance to win: https:// goo.gl/yFMTgV,i m entering to win a free samsung tablet thanks to delmarvavoip giveaway enter for your chance to win https goo gl yfmtgv, entering win free samsung tablet thanks delmarvavoip giveaway enter chance win https goo gl yfmtgv
???????????????????????????????????????????? http:// saigaijyouhou.com/blog-entry-140 09.html ?,???????????????????????????????????????????? http:// saigaijyouhou.com/blog-entry-140 09.html ?, http saigaijyouhou com blog entry  html, http saigaijyouhou com blog entry  html
#DIY & #Tools #4: Evolva Future Technology Bike Light USB 1800LM Cree with 7 Hours Runtime Original Samsung Bat... http:// ow.ly/8YZB5063i3Y,#DIY & #Tools #4: Evolva Future Technology Bike Light USB 1800LM Cree with 7 Hours Runtime Original Samsung Bat... http:// ow.ly/8YZB5063i3Y,diy  tools  evolva future technology bike light usb lm cree with  hours runtime original samsung bat http ow ly yzb i y,diy  tools  evolva future technology bike light usb lm cree  hours runtime original samsung bat http ow ly yzb 
"Macam biase . Cuti dah habis? (@Samsung SDI Energy Malaysia SDN. BHD. in Sungai Gadut, Negeri Sembilan) https://www. swarmapp.com/c/iMVYHsKfaIg","Macam biase . Cuti dah habis? (@Samsung SDI Energy Malaysia SDN. BHD. in Sungai Gadut, Negeri Sembilan) https://www. swarmapp.com/c/iMVYHsKfaIg",macam biase  cuti dah habis  samsung sdi energy malaysia sdn bhd in sungai gadut negeri sembilan https www swarmapp com c imvyhskfaig,macam biase  cuti dah habis  samsung sdi energy malaysia sdn bhd sungai gadut negeri sembilan https www swarmapp com imvyhskfaig
Design Hybrid Leather Protector Cover SAMSUNG GALA... #mobile #accessories https://www. wigadgets.com/products/desig n-hybrid-leather-protector-cover-samsung-galaxy-s6-edge-dlpc07-s6edgeamgr ? pic.twitter.com/hYlwK4DVyg,Design Hybrid Leather Protector Cover SAMSUNG GALA... #mobile #accessories https://www. wigadgets.com/products/desig n-hybrid-leather-protector-cover-samsung-galaxy-s6-edge-dlpc07-s6edgeamgr ? pic.twitter.com/hYlwK4DVyg,design hybrid leather protector cover samsung gala  mobile accessories https www wigadgets com products desig n hybrid leather protector cover samsung galaxy s edge dlpc s edgeamgr  pic twitter com hylwk dvyg,design hybrid leather protector cover samsung gala  mobile accessories https www wigadgets com products desig hybrid leather protector cover samsung galaxy edge dlpc edgeamgr  pic twitter com hylwk dvyg
#DIY & #Tools #4: Evolva Future Technology Bike Light USB 1800LM Cree with 7 Hours Runtime Original Samsung Bat... http:// ow.ly/1PX65063iaP,#DIY & #Tools #4: Evolva Future Technology Bike Light USB 1800LM Cree with 7 Hours Runtime Original Samsung Bat... http:// ow.ly/1PX65063iaP,diy  tools  evolva future technology bike light usb lm cree with  hours runtime original samsung bat http ow ly px iap,diy  tools  evolva future technology bike light usb lm cree  hours runtime original samsung bat http ow ly px iap
"Touch Bar reportedly made by Samsung , as Apple tests OLED for main MacBook screens https:// 9to5mac.com/2016/11/01/mac book-oled-display-screen/ ?","Touch Bar reportedly made by Samsung , as Apple tests OLED for main MacBook screens https:// 9to5mac.com/2016/11/01/mac book-oled-display-screen/ ?",touch bar reportedly made by samsung  as apple tests oled for main macbook screens https  to mac com mac book oled display screen,touch bar reportedly samsung  apple tests oled main macbook screens https  mac com mac book oled display screen
Y Bade de passer d'un iPhone a un Samsung,Y Bade de passer d'un iPhone a un Samsung,y bade de passer d un iphone a un samsung, bade passer iphone samsung
@LVPibai Lo que ser?a bonito es votar en LPL a Samsung White #TheDream,@LVPibai Lo que ser?a bonito es votar en LPL a Samsung White #TheDream,lvpibai lo que ser a bonito es votar en lpl a samsung white thedream,lvpibai lo que ser bonito es votar en lpl samsung white thedream
"(PRL) MOTOROLA PHILIPS SAMSUNG PHONE BATTERY CHARGER CARICABATTERIE 110/240V: EUR 12,90Scadenza: gioved? di... http:// ebay.to/2ff838m","(PRL) MOTOROLA PHILIPS SAMSUNG PHONE BATTERY CHARGER CARICABATTERIE 110/240V: EUR 12,90Scadenza: gioved? di... http:// ebay.to/2ff838m",prl motorola philips samsung phone battery charger caricabatterie v eur scadenza gioved di http ebay to ff m,prl motorola philips samsung phone battery charger caricabatterie eur scadenza gioved di http ebay ff 
"(PRL) SAMSUNG CAR BATTERY CHARGER CARICA BATTERIE AUTO CELLULARE VOITURE SGH NEW: EUR 12,90Scadenza: gioved?... http:// ebay.to/2eShld8","(PRL) SAMSUNG CAR BATTERY CHARGER CARICA BATTERIE AUTO CELLULARE VOITURE SGH NEW: EUR 12,90Scadenza: gioved?... http:// ebay.to/2eShld8",prl samsung car battery charger carica batterie auto cellulare voiture sgh new eur scadenza gioved http ebay to eshld,prl samsung car battery charger carica batterie auto cellulare voiture sgh new eur scadenza gioved http ebay eshld
Venez jouer au jeu : Gagnez un casque Samsung Gear VR ! du Club Metro http:// ln.is/clubmetro.lci. fr/qui/3hEW7 ?,Venez jouer au jeu : Gagnez un casque Samsung Gear VR ! du Club Metro http:// ln.is/clubmetro.lci. fr/qui/3hEW7 ?,venez jouer au jeu  gagnez un casque samsung gear vr  du club metro http ln is clubmetro lci fr qui hew,venez jouer au jeu  gagnez casque samsung gear vr  du club metro http ln clubmetro lci fr qui hew
for some reason my absolute top of the line samsung phone that there is no superior version of is not compatible with titanfall frontline,for some reason my absolute top of the line samsung phone that there is no superior version of is not compatible with titanfall frontline,for some reason my absolute top of the line samsung phone that there is no superior version of is not compatible with titanfall frontline, reason absolute line samsung phone superior version compatible titanfall frontline
"MT @R2_Logistics Lessons for #Procurement & #SupplyChain from #Samsung #GalaxyNote7 Recall pic.twitter.com/Re0XW7iR3q "" http:// ow.ly/U7YI305KuY3","MT @R2_Logistics Lessons for #Procurement & #SupplyChain from #Samsung #GalaxyNote7 Recall pic.twitter.com/Re0XW7iR3q "" http:// ow.ly/U7YI305KuY3","mt r _logistics lessons for procurement  supplychain from samsung galaxynote recall pic twitter com re xw ir q "" http ow ly u yi kuy","mt _logistics lessons procurement  supplychain samsung galaxynote recall pic twitter com xw ir "" http ow ly yi kuy"
"Pienso en los que compraron el samsung s7 apenas salio, lo que les costo y que ahora vean que los estan regalando con las ofertas!! Jajaja","Pienso en los que compraron el samsung s7 apenas salio, lo que les costo y que ahora vean que los estan regalando con las ofertas!! Jajaja",pienso en los que compraron el samsung s apenas salio lo que les costo y que ahora vean que los estan regalando con las ofertas jajaja,pienso en los que compraron el samsung apenas salio lo que les costo que ahora vean que los estan regalando las ofertas jajaja
#Tecnologia : El Samsung Galaxy S8 tendr? un 90% de ratio pantalla/volumen al igual que el Mi MIX http:// bit.ly/2fBH6zT,#Tecnologia : El Samsung Galaxy S8 tendr? un 90% de ratio pantalla/volumen al igual que el Mi MIX http:// bit.ly/2fBH6zT,tecnologia  el samsung galaxy s tendr un  de ratio pantalla volumen al igual que el mi mix http bit ly fbh zt,tecnologia  el samsung galaxy tendr  ratio pantalla volumen al igual que el mi mix http bit ly fbh zt
Gostei de um v?deo @YouTube http:// youtu.be/UF7mMXmGECs?aV azou ? ! Confira imagens e v?deo do Samsung Galaxy A5 2017,Gostei de um v?deo @YouTube http:// youtu.be/UF7mMXmGECs?aV azou ? ! Confira imagens e v?deo do Samsung Galaxy A5 2017,gostei de um v deo youtube http youtu be uf mmxmgecs av azou   confira imagens e v deo do samsung galaxy a,gostei um deo youtube http youtu uf mmxmgecs av azou   confira imagens deo samsung galaxy 
#caracasdata The Samsung Galaxy S8 could be mostly screen - CNET http:// ow.ly/alw35063hKH,#caracasdata The Samsung Galaxy S8 could be mostly screen - CNET http:// ow.ly/alw35063hKH,caracasdata the samsung galaxy s could be mostly screen  cnet http ow ly alw hkh,caracasdata samsung galaxy screen  cnet http ow ly alw hkh
Samsung Electronics ????????? ?????????? ? ??????????? ??????????? ??????? ????????? ?? ???????? ??????????? ????????? ??????,Samsung Electronics ????????? ?????????? ? ??????????? ??????????? ??????? ????????? ?? ???????? ??????????? ????????? ??????,samsung electronics,samsung electronics
New Chromium Code Outs Samsung 's ?Caroline? Chromebook http:// buff.ly/2eYSbr2 #chromeos,New Chromium Code Outs Samsung 's ?Caroline? Chromebook http:// buff.ly/2eYSbr2 #chromeos,new chromium code outs samsung s caroline chromebook http buff ly eysbr  chromeos,new chromium code outs samsung caroline chromebook http buff ly eysbr  chromeos
????????????????????????????????????? ?????????? ( SAMSUNG ),????????????????????????????????????? ?????????? ( SAMSUNG ),   samsung,   samsung
Pilot Kicks People Off Flight After Samsung ?Galaxy Note 7? Found On WiFi List http:// dlvr.it/MZPLyB #tcot pic.twitter.com/Yx3G14po4q,Pilot Kicks People Off Flight After Samsung ?Galaxy Note 7? Found On WiFi List http:// dlvr.it/MZPLyB #tcot pic.twitter.com/Yx3G14po4q,pilot kicks people off flight after samsung galaxy note  found on wifi list http dlvr it mzplyb tcot pic twitter com yx g po q,pilot kicks people flight samsung galaxy note  wifi list http dlvr mzplyb tcot pic twitter com yx po 
Gostei de um v?deo @YouTube http:// youtu.be/UF7mMXmGECs?aV azou ? ! Confira imagens e v?deo do Samsung Galaxy A5 2017,Gostei de um v?deo @YouTube http:// youtu.be/UF7mMXmGECs?aV azou ? ! Confira imagens e v?deo do Samsung Galaxy A5 2017,gostei de um v deo youtube http youtu be uf mmxmgecs av azou   confira imagens e v deo do samsung galaxy a,gostei um deo youtube http youtu uf mmxmgecs av azou   confira imagens deo samsung galaxy 
"#3: Samsung Galaxy S7, Black 32GB (Verizon Wireless): Samsung Galaxy S7, Black 32GB (Verizon Wireless) by Sam... http:// amzn.to/2f7KAJT","#3: Samsung Galaxy S7, Black 32GB (Verizon Wireless): Samsung Galaxy S7, Black 32GB (Verizon Wireless) by Sam... http:// amzn.to/2f7KAJT", samsung galaxy s black gb verizon wireless samsung galaxy s black gb verizon wireless by sam http amzn to f kajt, samsung galaxy black gb verizon wireless samsung galaxy black gb verizon wireless sam http amzn kajt
"Conhe?a o Samsung Chromebook 3: novo, leve, pr?tico e seguro http://www. tecmundo.com.br/chromebook/111 204-conheca-samsung-chromebook-3-notebook-chrome-os.htm ?","Conhe?a o Samsung Chromebook 3: novo, leve, pr?tico e seguro http://www. tecmundo.com.br/chromebook/111 204-conheca-samsung-chromebook-3-notebook-chrome-os.htm ?",conhe a o samsung chromebook  novo leve pr tico e seguro http www tecmundo com br chromebook  conheca samsung chromebook notebook chrome os htm,conhe samsung chromebook  novo leve pr tico seguro http www tecmundo com br chromebook  conheca samsung chromebook notebook chrome os htm
The Samsung fiasco is not finished http:// ow.ly/RtxK305KyxH ^AG,The Samsung fiasco is not finished http:// ow.ly/RtxK305KyxH ^AG,the samsung fiasco is not finished http ow ly rtxk kyxh ^ag, samsung fiasco finished http ow ly rtxk kyxh ^ag
"Kan h?mta ut en ny samsung p? Telia nu, har ett paket och h?mta. Men nej juste har ju inget l?gg","Kan h?mta ut en ny samsung p? Telia nu, har ett paket och h?mta. Men nej juste har ju inget l?gg",kan h mta ut en ny samsung p telia nu har ett paket och h mta men nej juste har ju inget l gg,kan mta ut en ny samsung telia nu har ett paket och mta men nej juste har ju inget gg
celular que trava demais s? o meu mesmo olha que n?o ? samsung,celular que trava demais s? o meu mesmo olha que n?o ? samsung,celular que trava demais s o meu mesmo olha que n o  samsung,celular que trava demais meu mesmo olha que  samsung
Samsung Galaxy Note 5 | Note Edge | Note 4 Leather Sleeve | http:// etsy.me/1jL75TN | #GalaxyNote5 #GalaxyNote5Sleeve #NoteEdge,Samsung Galaxy Note 5 | Note Edge | Note 4 Leather Sleeve | http:// etsy.me/1jL75TN | #GalaxyNote5 #GalaxyNote5Sleeve #NoteEdge,samsung galaxy note  | note edge | note  leather sleeve | http etsy me jl tn | galaxynote  galaxynote sleeve noteedge,samsung galaxy note  | note edge | note  leather sleeve | http etsy jl tn | galaxynote  galaxynote sleeve noteedge
"?(^o^)?Just saw this on Amazon: Samsung Galaxy S5, White 16GB (AT&T) by Samsung for $569.99 http:// amzn.to/1i9KkHS @amazon ????","?(^o^)?Just saw this on Amazon: Samsung Galaxy S5, White 16GB (AT&T) by Samsung for $569.99 http:// amzn.to/1i9KkHS @amazon ????",^o^ just saw this on amazon samsung galaxy s white gb at t by samsung for  http amzn to i kkhs amazon,^o^ just saw amazon samsung galaxy white gb samsung  http amzn kkhs amazon
"Participa! SORTEO INTERNACIONAL | Samsung Galaxy S7 Dorado de @DonAndroidWeb , ?como participar? Ve el video https:// youtu.be/te0Fp-BOmTg","Participa! SORTEO INTERNACIONAL | Samsung Galaxy S7 Dorado de @DonAndroidWeb , ?como participar? Ve el video https:// youtu.be/te0Fp-BOmTg",participa sorteo internacional | samsung galaxy s dorado de donandroidweb  como participar ve el video https youtu be te fp bomtg,participa sorteo internacional | samsung galaxy dorado donandroidweb  como participar ve el video https youtu te fp bomtg
"Samsung invierte US$1,000 millones para aumentar producci?n de chips en EE.UU. http:// cnet.co/2fe5piY","Samsung invierte US$1,000 millones para aumentar producci?n de chips en EE.UU. http:// cnet.co/2fe5piY",samsung invierte us millones para aumentar producci n de chips en ee uu http cnet co fe piy,samsung invierte millones para aumentar producci chips en ee uu http cnet fe piy
I need an iPhone i hear twitter give them 200characters while us Samsung & others get 140.Those are also advantages of being an iphone users,I need an iPhone i hear twitter give them 200characters while us Samsung & others get 140.Those are also advantages of being an iphone users,i need an iphone i hear twitter give them characters while us samsung  others get those are also advantages of being an iphone users, need iphone hear twitter characters samsung  advantages iphone users
