Tweets,Tweet,Tweet2,Tweet3
"A partir de agora, eu e o Sushi vamos deixar a carteira em casa por motivos de Samsung Pay + Mastercard <3 pic.twitter.com/rb5a2kbPET","A partir de agora, eu e o Sushi vamos deixar a carteira em casa por motivos de Samsung Pay + Mastercard <3 pic.twitter.com/rb5a2kbPET",a partir de agora eu e o sushi vamos deixar a carteira em casa por motivos de samsung pay  mastercard  pic twitter com rb a kbpet, partir agora eu sushi vamos deixar carteira em casa por motivos samsung pay  mastercard  pic twitter com rb kbpet
Decrypt the runes to reveal how BIG #VR really is: Facebook Google Valve Sony Samsung Microsoft and... Google again... Image via @unity3D pic.twitter.com/6klG6tvXCm,Decrypt the runes to reveal how BIG #VR really is: Facebook Google Valve Sony Samsung Microsoft and... Google again... Image via @unity3D pic.twitter.com/6klG6tvXCm,decrypt the runes to reveal how big vr really is facebook google valve sony samsung microsoft and google again image via unity d pic twitter com klg tvxcm,decrypt runes reveal big vr really facebook google valve sony samsung microsoft google image unity pic twitter com klg tvxcm
El desastre del Galaxy Note 7 en una imagen: ejecutivos de Samsung se arrodillan para pedir perd?n en China http:// uni.vi/EQq0100nNSk,El desastre del Galaxy Note 7 en una imagen: ejecutivos de Samsung se arrodillan para pedir perd?n en China http:// uni.vi/EQq0100nNSk,el desastre del galaxy note  en una imagen ejecutivos de samsung se arrodillan para pedir perd n en china http uni vi eqq nnsk,el desastre del galaxy note  en una imagen ejecutivos samsung se arrodillan para pedir perd en china http uni vi eqq nnsk
"Telkomsel: #########November 02, 2016 at 06:51AM ##################### destriaa_ Cara aktivasi paket Samsung Galaxy Plan, silakan dial *3?","Telkomsel: #########November 02, 2016 at 06:51AM ##################### destriaa_ Cara aktivasi paket Samsung Galaxy Plan, silakan dial *3?",telkomsel  november   at am  destriaa_ cara aktivasi paket samsung galaxy plan silakan dial,telkomsel  november    destriaa_ cara aktivasi paket samsung galaxy plan silakan dial
samsung S5 16G 5500NT second garansi 1 bulan,samsung S5 16G 5500NT second garansi 1 bulan,samsung s  g nt second garansi  bulan,samsung  nt second garansi  bulan
#Samsung Galaxy Ace 4 Neo G318ML Factory Unlocked G...$78.18 ? - http:// wp.me/p6MWBj-4Y pic.twitter.com/1yqHEjfFoV,#Samsung Galaxy Ace 4 Neo G318ML Factory Unlocked G...$78.18 ? - http:// wp.me/p6MWBj-4Y pic.twitter.com/1yqHEjfFoV,samsung galaxy ace  neo g ml factory unlocked g   http wp me p mwbj y pic twitter com yqhejffov,samsung galaxy ace  neo ml factory unlocked   http wp mwbj pic twitter com yqhejffov
Samsung MX-J630 2.0 Channel 230 Watt Wired Audio Giga System (2015 Model) Reviews http:// bargainsnfinds.com/2016/11/01/sam sung-mx-j630-2-0-channel-230-watt-wired-audio-giga-system-2015-model-reviews/ ?,Samsung MX-J630 2.0 Channel 230 Watt Wired Audio Giga System (2015 Model) Reviews http:// bargainsnfinds.com/2016/11/01/sam sung-mx-j630-2-0-channel-230-watt-wired-audio-giga-system-2015-model-reviews/ ?,samsung mx j  channel  watt wired audio giga system  model reviews http bargainsnfinds com sam sung mx j channel watt wired audio giga system model reviews,samsung mx  channel  watt wired audio giga  model reviews http bargainsnfinds com sam sung mx channel watt wired audio giga model reviews
"El desbloqueo del m?vil con la mirada, la novedad de Samsung #tecnolog?a http://www. tecnovedosos.com/desbloqueo-mov il-mirada-samsung/ ?","El desbloqueo del m?vil con la mirada, la novedad de Samsung #tecnolog?a http://www. tecnovedosos.com/desbloqueo-mov il-mirada-samsung/ ?",el desbloqueo del m vil con la mirada la novedad de samsung tecnolog a http www tecnovedosos com desbloqueo mov il mirada samsung,el desbloqueo del vil la mirada la novedad samsung tecnolog http www tecnovedosos com desbloqueo mov il mirada samsung
"Rumor: 90% Bodi Galaxy S8 adalah Layar: Seorang teknisi Samsung mengatakan, smartphone yang mereka luncurkan ... http:// bit.ly/2fCux7w","Rumor: 90% Bodi Galaxy S8 adalah Layar: Seorang teknisi Samsung mengatakan, smartphone yang mereka luncurkan ... http:// bit.ly/2fCux7w",rumor  bodi galaxy s adalah layar seorang teknisi samsung mengatakan smartphone yang mereka luncurkan  http bit ly fcux w,rumor  bodi galaxy adalah layar seorang teknisi samsung mengatakan smartphone yang mereka luncurkan  http bit ly fcux 
Greenpeace slams Samsung for failing to detail disposal plan for millions of recalled Note 7 smartphones. http:// cnn.it/2el6pUY pic.twitter.com/AAKENnlxEa,Greenpeace slams Samsung for failing to detail disposal plan for millions of recalled Note 7 smartphones. http:// cnn.it/2el6pUY pic.twitter.com/AAKENnlxEa,greenpeace slams samsung for failing to detail disposal plan for millions of recalled note  smartphones http cnn it el puy pic twitter com aakennlxea,greenpeace slams samsung failing disposal plan millions recalled note  smartphones http cnn el puy pic twitter com aakennlxea
The Samsung Galaxy S8 could be mostly screen - CNET http://www. pcmix.net/the-samsung-ga laxy-s8-could-be-mostly-screen-cnet/?utm_campaign=Twitter&utm_medium=twitter&utm_source=twitter ? #pcmixnet,The Samsung Galaxy S8 could be mostly screen - CNET http://www. pcmix.net/the-samsung-ga laxy-s8-could-be-mostly-screen-cnet/?utm_campaign=Twitter&utm_medium=twitter&utm_source=twitter ? #pcmixnet,the samsung galaxy s could be mostly screen  cnet http www pcmix net the samsung ga laxy s could be mostly screen cnet utm_campaign twitter utm_medium twitter utm_source twitter  pcmixnet, samsung galaxy screen  cnet http www pcmix net samsung ga laxy screen cnet utm_campaign twitter utm_medium twitter utm_source twitter  pcmixnet
"A Coreia do Sul ? basicamente dominada por fam?lias corporativas nos ?ltimos 50 anos, as chamadas chaebols, como exemplo, temos a Samsung .","A Coreia do Sul ? basicamente dominada por fam?lias corporativas nos ?ltimos 50 anos, as chamadas chaebols, como exemplo, temos a Samsung .",a coreia do sul  basicamente dominada por fam lias corporativas nos ltimos  anos as chamadas chaebols como exemplo temos a samsung, coreia sul  basicamente dominada por fam lias corporativas nos ltimos  anos chamadas chaebols como exemplo temos samsung
"Telkomsel: destriaa_ Cara aktivasi paket Samsung Galaxy Plan, silakan dial *363#. Info http:// tsel.me/8MDM :) -Nura","Telkomsel: destriaa_ Cara aktivasi paket Samsung Galaxy Plan, silakan dial *363#. Info http:// tsel.me/8MDM :) -Nura",telkomsel destriaa_ cara aktivasi paket samsung galaxy plan silakan dial  info http tsel me mdm  nura,telkomsel destriaa_ cara aktivasi paket samsung galaxy plan silakan dial  info http tsel mdm  nura
Crl meu celular ta mt quente se fosse Samsung ja estaria preocupada,Crl meu celular ta mt quente se fosse Samsung ja estaria preocupada,crl meu celular ta mt quente se fosse samsung ja estaria preocupada,crl meu celular ta mt quente se fosse samsung ja estaria preocupada
#robbie #leto Harley Quinn case For Samsung Galaxy S7 cover hard Transparent ... http://www. worldofharley.com/harley-quinn-c ase-for-samsung-galaxy-s7-cover-hard-transparent-plastic-coque-phone-bag-case-for-samsung-galaxy-s7-edge-s6-fundas/ ? pic.twitter.com/npk4OC6ABY,#robbie #leto Harley Quinn case For Samsung Galaxy S7 cover hard Transparent ... http://www. worldofharley.com/harley-quinn-c ase-for-samsung-galaxy-s7-cover-hard-transparent-plastic-coque-phone-bag-case-for-samsung-galaxy-s7-edge-s6-fundas/ ? pic.twitter.com/npk4OC6ABY,robbie leto harley quinn case for samsung galaxy s cover hard transparent  http www worldofharley com harley quinn c ase for samsung galaxy s cover hard transparent plastic coque phone bag case for samsung galaxy s edge s fundas  pic twitter com npk oc aby,robbie leto harley quinn case samsung galaxy cover hard transparent  http www worldofharley com harley quinn ase samsung galaxy cover hard transparent plastic coque phone bag case samsung galaxy edge fundas  pic twitter com npk oc aby
"Seorang teknisi Samsung mengatakan, smartphone yang mereka luncurkan tahun depan dapat memiliki rasio bodi da... http:// bit.ly/2el7Z9r","Seorang teknisi Samsung mengatakan, smartphone yang mereka luncurkan tahun depan dapat memiliki rasio bodi da... http:// bit.ly/2el7Z9r",seorang teknisi samsung mengatakan smartphone yang mereka luncurkan tahun depan dapat memiliki rasio bodi da http bit ly el z r,seorang teknisi samsung mengatakan smartphone yang mereka luncurkan tahun depan dapat memiliki rasio bodi da http bit ly el 
?Cu?l es el peor dispositivo del siglo XXI? ? El samsung que explota y los iPhones http:// l.ask.fm/igoto/45DKECN7 5V62DDAUPY6IQO6372PTJIAZ2OTKXCN6BX62BYFIRBZZMZSMF5HMUSZRKO3PQGKEA4YFKEQPY43OA7PQPXYKVBJAWQDVHFCJB5OTWI7UAOEDO4HRT2SPJWT2266ZQHRJ3LMH7BEEISIAKELC73PG75EP73LU3YKYYDZY2SG4A5WFRRPR6BB3L5OOYN6A==== ?,?Cu?l es el peor dispositivo del siglo XXI? ? El samsung que explota y los iPhones http:// l.ask.fm/igoto/45DKECN7 5V62DDAUPY6IQO6372PTJIAZ2OTKXCN6BX62BYFIRBZZMZSMF5HMUSZRKO3PQGKEA4YFKEQPY43OA7PQPXYKVBJAWQDVHFCJB5OTWI7UAOEDO4HRT2SPJWT2266ZQHRJ3LMH7BEEISIAKELC73PG75EP73LU3YKYYDZY2SG4A5WFRRPR6BB3L5OOYN6A==== ?,cu l es el peor dispositivo del siglo xxi  el samsung que explota y los iphones http l ask fm igoto dkecn  v ddaupy iqo ptjiaz otkxcn bx byfirbzzmzsmf hmuszrko pqgkea yfkeqpy oa pqpxykvbjawqdvhfcjb otwi uaoedo hrt spjwt zqhrj lmh beeisiakelc pg ep lu ykyydzy sg a wfrrpr bb l ooyn a,cu es el peor dispositivo del siglo xxi  el samsung que explota los iphones http ask fm igoto dkecn  ddaupy iqo ptjiaz otkxcn bx byfirbzzmzsmf hmuszrko pqgkea yfkeqpy oa pqpxykvbjawqdvhfcjb otwi uaoedo hrt spjwt zqhrj lmh beeisiakelc pg ep lu ykyydzy sg wfrrpr bb ooyn 
"""The Samsung Galaxy S8 could be mostly screen - CNET"" https://www. cnet.com/news/samsung-g alaxy-s8-full-screen/#ftag=CAD590a51e ? #tech #feedly","""The Samsung Galaxy S8 could be mostly screen - CNET"" https://www. cnet.com/news/samsung-g alaxy-s8-full-screen/#ftag=CAD590a51e ? #tech #feedly","""the samsung galaxy s could be mostly screen  cnet"" https www cnet com news samsung g alaxy s full screen ftag cad a e  tech feedly","""the samsung galaxy screen  cnet"" https www cnet com news samsung alaxy screen ftag cad  tech feedly"
New Samsung Galaxy S3 Mini G730A Unlocked AT&T Blue Cellphone CAMERA Tmobile GSM http:// bit.ly/2c8FD3V http:// ift.tt/2ft5Ueb,New Samsung Galaxy S3 Mini G730A Unlocked AT&T Blue Cellphone CAMERA Tmobile GSM http:// bit.ly/2c8FD3V http:// ift.tt/2ft5Ueb,new samsung galaxy s mini g a unlocked at t blue cellphone camera tmobile gsm http bit ly c fd v http ift tt ft ueb,new samsung galaxy mini unlocked blue cellphone camera tmobile gsm http bit ly fd http ift tt ft ueb
@jenlschreiber @loganperry241 & you're lucky you have a samsung,@jenlschreiber @loganperry241 & you're lucky you have a samsung,jenlschreiber loganperry  you re lucky you have a samsung,jenlschreiber loganperry  lucky samsung
@BlazterGA El Samsung J7 si tiene un gran dpi @Reazyh_,@BlazterGA El Samsung J7 si tiene un gran dpi @Reazyh_,blazterga el samsung j si tiene un gran dpi reazyh_,blazterga el samsung si tiene gran dpi reazyh_
???????????????? ???????? ???????? Samsung ?????????? ??????????? ?????? ????????????? ????????? Samsung Heavy... http:// fb.me/1rw7VbW2L,???????????????? ???????? ???????? Samsung ?????????? ??????????? ?????? ????????????? ????????? Samsung Heavy... http:// fb.me/1rw7VbW2L,   samsung      samsung heavy http fb me rw vbw l,   samsung      samsung heavy http fb rw vbw 
Samsung Galaxy S6 edge ? 32 GB ? White ? AT&T pic.twitter.com/XYp7btlBUK,Samsung Galaxy S6 edge ? 32 GB ? White ? AT&T pic.twitter.com/XYp7btlBUK,samsung galaxy s edge   gb  white  at t pic twitter com xyp btlbuk,samsung galaxy edge   gb  white  pic twitter com xyp btlbuk
"destriaa_ Cara aktivasi paket Samsung Galaxy Plan, silakan dial *363#. Info http:// tsel.me/8MDM :) -Nura","destriaa_ Cara aktivasi paket Samsung Galaxy Plan, silakan dial *363#. Info http:// tsel.me/8MDM :) -Nura",destriaa_ cara aktivasi paket samsung galaxy plan silakan dial  info http tsel me mdm  nura,destriaa_ cara aktivasi paket samsung galaxy plan silakan dial  info http tsel mdm  nura
Samsung Investing $1 Billion in Austin Chip Facility #austin #news http:// tinyurl.com/jcs3f2c,Samsung Investing $1 Billion in Austin Chip Facility #austin #news http:// tinyurl.com/jcs3f2c,samsung investing  billion in austin chip facility austin news http tinyurl com jcs f c,samsung investing  billion austin chip facility austin news http tinyurl com jcs 
Samsung Galaxy S8 Coming With Edge To Edge OLED Display? http:// bit.ly/2eSrd74 #samsung #mobile,Samsung Galaxy S8 Coming With Edge To Edge OLED Display? http:// bit.ly/2eSrd74 #samsung #mobile,samsung galaxy s coming with edge to edge oled display http bit ly esrd  samsung mobile,samsung galaxy coming edge edge oled display http bit ly esrd  samsung mobile
LG G6 could inherit one key Samsung Galaxy Note 7 feature http:// bit.ly/2faRtHC pic.twitter.com/MCBdrR6sZ7,LG G6 could inherit one key Samsung Galaxy Note 7 feature http:// bit.ly/2faRtHC pic.twitter.com/MCBdrR6sZ7,lg g could inherit one key samsung galaxy note  feature http bit ly farthc pic twitter com mcbdrr sz,lg inherit key samsung galaxy note  feature http bit ly farthc pic twitter com mcbdrr sz
Hey @Apple and @Samsung : please build user-repairable phones like @Fairphone . https:// shop.fairphone.com/en/spare-parts pic.twitter.com/JgdJZI2uWH,Hey @Apple and @Samsung : please build user-repairable phones like @Fairphone . https:// shop.fairphone.com/en/spare-parts pic.twitter.com/JgdJZI2uWH,hey apple and samsung  please build user repairable phones like fairphone  https shop fairphone com en spare parts pic twitter com jgdjzi uwh,hey apple samsung  build user repairable phones like fairphone  https shop fairphone com en spare parts pic twitter com jgdjzi uwh
"@nicovbe Un Samsung de 40"", full HD, a 199990 en Ripley. Pr?ctico, f?cil de usar y buena imagen.","@nicovbe Un Samsung de 40"", full HD, a 199990 en Ripley. Pr?ctico, f?cil de usar y buena imagen.","nicovbe un samsung de "" full hd a  en ripley pr ctico f cil de usar y buena imagen","nicovbe samsung "" hd  en ripley pr ctico cil usar buena imagen"
I liked a @YouTube video from @ahmad81okla http:// youtu.be/iCyisZBbLew?a ZTE ZMAX Pro VS Samsung Galaxy S7 Speed Performance Test,I liked a @YouTube video from @ahmad81okla http:// youtu.be/iCyisZBbLew?a ZTE ZMAX Pro VS Samsung Galaxy S7 Speed Performance Test,i liked a youtube video from ahmad okla http youtu be icyiszbblew a zte zmax pro vs samsung galaxy s speed performance test, liked youtube video ahmad okla http youtu icyiszbblew zte zmax pro vs samsung galaxy speed performance test
"2,5"" 250GB Samsung SSD 750 EVO SATA Solid State Drive 540MB / 520MB PC Notebook - https:// pc-store-online.de/25-250gb-samsu ng-ssd-750-evo-sata-solid-state-drive-540mb-520mb-pc-notebook/ ? pic.twitter.com/p0BsZpIISY","2,5"" 250GB Samsung SSD 750 EVO SATA Solid State Drive 540MB / 520MB PC Notebook - https:// pc-store-online.de/25-250gb-samsu ng-ssd-750-evo-sata-solid-state-drive-540mb-520mb-pc-notebook/ ? pic.twitter.com/p0BsZpIISY",""" gb samsung ssd  evo sata solid state drive mb  mb pc notebook  https pc store online de gb samsu ng ssd evo sata solid state drive mb mb pc notebook  pic twitter com p bszpiisy",""" gb samsung ssd  evo sata solid state drive mb  mb pc notebook  https pc store online gb samsu ng ssd evo sata solid state drive mb mb pc notebook  pic twitter com bszpiisy"
@phillybrown10 just switch to Samsung and save yourself the headache.,@phillybrown10 just switch to Samsung and save yourself the headache.,phillybrown just switch to samsung and save yourself the headache,phillybrown just switch samsung save headache
??????????? PPAP :You need a Samsung Galaxy Note7 https:// youtu.be/ifdRJG3R4X0 @YouTube ????,??????????? PPAP :You need a Samsung Galaxy Note7 https:// youtu.be/ifdRJG3R4X0 @YouTube ????, ppap you need a samsung galaxy note https youtu be ifdrjg r x  youtube, ppap need samsung galaxy note https youtu ifdrjg  youtube
"@marktyork shit photo Mark, you need an Android Samsung not an iphone!","@marktyork shit photo Mark, you need an Android Samsung not an iphone!",marktyork shit photo mark you need an android samsung not an iphone,marktyork shit photo mark need android samsung iphone
"Samsung Laptop, grau/schwarz http:// worldorganisation.net/samsung-laptop -grauschwarz/ ?","Samsung Laptop, grau/schwarz http:// worldorganisation.net/samsung-laptop -grauschwarz/ ?",samsung laptop grau schwarz http worldorganisation net samsung laptop grauschwarz,samsung laptop grau schwarz http worldorganisation net samsung laptop grauschwarz
Samsung 's built-in smart appliances blend in with your decor https://www. engadget.com/2016/10/11/sam sung-built-in-smart-home-appliances/?DXp4u ?,Samsung 's built-in smart appliances blend in with your decor https://www. engadget.com/2016/10/11/sam sung-built-in-smart-home-appliances/?DXp4u ?,samsung s built in smart appliances blend in with your decor https www engadget com sam sung built in smart home appliances dxp u,samsung built smart appliances blend decor https www engadget com sam sung built smart home appliances dxp 
and im here stick with samsung corby stunning camera https:// twitter.com/MKBHD/status/7 93504658283167744 ?,and im here stick with samsung corby stunning camera https:// twitter.com/MKBHD/status/7 93504658283167744 ?,and im here stick with samsung corby stunning camera https twitter com mkbhd status, im stick samsung corby stunning camera https twitter com mkbhd status
@AdamOfDc949 @HackingDave @SteveD3 @hacks4pancakes and this trick works since Samsung Galaxy S3 I think.,@AdamOfDc949 @HackingDave @SteveD3 @hacks4pancakes and this trick works since Samsung Galaxy S3 I think.,adamofdc  hackingdave steved  hacks pancakes and this trick works since samsung galaxy s i think,adamofdc  hackingdave steved  hacks pancakes trick works samsung galaxy think
??????? ?? ??????? samsung scx-4824fn http:// polynesiaforum.ru/showforum/1/dr ayver-na-printer-samsung-scx4824fn/ ? #BQ #??????? #?????,??????? ?? ??????? samsung scx-4824fn http:// polynesiaforum.ru/showforum/1/dr ayver-na-printer-samsung-scx4824fn/ ? #BQ #??????? #?????,   samsung scx fn http polynesiaforum ru showforum dr ayver na printer samsung scx fn   bq,   samsung scx fn http polynesiaforum ru showforum dr ayver na printer samsung scx fn   bq
Me ha gustado un v?deo de @YouTube de @isa_marcial ( http:// youtu.be/pYZtX-u425Q?a - Samsung Galaxy J2 - Review en espa?ol).,Me ha gustado un v?deo de @YouTube de @isa_marcial ( http:// youtu.be/pYZtX-u425Q?a - Samsung Galaxy J2 - Review en espa?ol).,me ha gustado un v deo de youtube de isa_marcial  http youtu be pyztx u q a  samsung galaxy j  review en espa ol, ha gustado deo youtube isa_marcial  http youtu pyztx  samsung galaxy  review en espa ol
"Dumping 4.3 million Samsung phones is an environmental disaster warns Greenpeace: SEOUL, Nov. 1, 2016 ? Samsu... http:// bit.ly/2f7T1Vv","Dumping 4.3 million Samsung phones is an environmental disaster warns Greenpeace: SEOUL, Nov. 1, 2016 ? Samsu... http:// bit.ly/2f7T1Vv",dumping  million samsung phones is an environmental disaster warns greenpeace seoul nov    samsu http bit ly f t vv,dumping  million samsung phones environmental disaster warns greenpeace seoul nov    samsu http bit ly vv
"Samsung ?s New AI Assistant Will B? Fr?m Th? Creat?rs ?f Siri, But ?Viv? Is Alread?? http:// newspaperpost.com/2016/11/01/sam sungs-new-ai-assistant-will-b%d0%b5-fr%d0%bem-th%d0%b5-creat%d0%bers-%d0%bef-siri-but-viv-is-alread%d1%83-light-years-ahead-%d0%bef-its-c%d0%beusin/ ? pic.twitter.com/9FrIXd7ueK","Samsung ?s New AI Assistant Will B? Fr?m Th? Creat?rs ?f Siri, But ?Viv? Is Alread?? http:// newspaperpost.com/2016/11/01/sam sungs-new-ai-assistant-will-b%d0%b5-fr%d0%bem-th%d0%b5-creat%d0%bers-%d0%bef-siri-but-viv-is-alread%d1%83-light-years-ahead-%d0%bef-its-c%d0%beusin/ ? pic.twitter.com/9FrIXd7ueK",samsung s new ai assistant will b fr m th creat rs f siri but viv is alread http newspaperpost com sam sungs new ai assistant will b d b fr d bem th d b creat d bers d bef siri but viv is alread d light years ahead d bef its c d beusin  pic twitter com frixd uek,samsung new ai assistant fr th creat rs siri viv alread http newspaperpost com sam sungs new ai assistant fr bem th creat bers bef siri viv alread light years ahead bef beusin  pic twitter com frixd uek
Harga dan Spesifikasi Kamera Samsung NX1000 Terbaru - http://www. situskamera.com/?p=749 via @Situskamera.com,Harga dan Spesifikasi Kamera Samsung NX1000 Terbaru - http://www. situskamera.com/?p=749 via @Situskamera.com,harga dan spesifikasi kamera samsung nx terbaru  http www situskamera com p via situskamera com,harga dan spesifikasi kamera samsung nx terbaru  http www situskamera com situskamera com
"LOVE MEI Ultra Protective Case for Samsung GALAXY S7 Edge, Waterproof Shockproof Snow http:// amzn.to/2el6LL3 pic.twitter.com/37zu3d0PNa","LOVE MEI Ultra Protective Case for Samsung GALAXY S7 Edge, Waterproof Shockproof Snow http:// amzn.to/2el6LL3 pic.twitter.com/37zu3d0PNa",love mei ultra protective case for samsung galaxy s edge waterproof shockproof snow http amzn to el ll pic twitter com zu d pna,love mei ultra protective case samsung galaxy edge waterproof shockproof snow http amzn el ll pic twitter com zu pna
"destriaa_ Cara aktivasi paket Samsung Galaxy Plan, silakan dial *363#. Info http:// tsel.me/8MDM :) -Nura","destriaa_ Cara aktivasi paket Samsung Galaxy Plan, silakan dial *363#. Info http:// tsel.me/8MDM :) -Nura",destriaa_ cara aktivasi paket samsung galaxy plan silakan dial  info http tsel me mdm  nura,destriaa_ cara aktivasi paket samsung galaxy plan silakan dial  info http tsel mdm  nura
??????? 5 ?????. 4X ?????????????? 3D ??-???? ??? LG/Sony/ Samsung ?? ????????????? http:// dlvr.it/MZQ700 pic.twitter.com/uSUD0iUPjY,??????? 5 ?????. 4X ?????????????? 3D ??-???? ??? LG/Sony/ Samsung ?? ????????????? http:// dlvr.it/MZQ700 pic.twitter.com/uSUD0iUPjY,   x  d   lg sony samsung   http dlvr it mzq pic twitter com usud iupjy,      lg sony samsung   http dlvr mzq pic twitter com usud iupjy
#AliExpress US $13.48 100% Original SAMSUNG 128GB/64GB/32GB USB 3.0 Flash Drives USB ... https:// goo.gl/jz9MZg pic.twitter.com/NZdugjzLfF,#AliExpress US $13.48 100% Original SAMSUNG 128GB/64GB/32GB USB 3.0 Flash Drives USB ... https:// goo.gl/jz9MZg pic.twitter.com/NZdugjzLfF,aliexpress us   original samsung gb gb gb usb  flash drives usb  https goo gl jz mzg pic twitter com nzdugjzlff,aliexpress   original samsung gb gb gb usb  flash drives usb  https goo gl jz mzg pic twitter com nzdugjzlff
Samsung Galaxy S7 edge - http:// goo.gl/o9PnKN #SamsungGalaxyS7edge #GalaxyS7edge #??????? #hitech #?????? #???????? #????? pic.twitter.com/u83vkihjj4,Samsung Galaxy S7 edge - http:// goo.gl/o9PnKN #SamsungGalaxyS7edge #GalaxyS7edge #??????? #hitech #?????? #???????? #????? pic.twitter.com/u83vkihjj4,samsung galaxy s edge  http goo gl o pnkn samsunggalaxys edge galaxys edge  hitech    pic twitter com u vkihjj,samsung galaxy edge  http goo gl pnkn samsunggalaxys edge galaxys edge  hitech    pic twitter com vkihjj
"Technology: Samsung unveils latest mobile and entertainment accessories,These accessories are only available... pic.twitter.com/eGKdCdY9EU","Technology: Samsung unveils latest mobile and entertainment accessories,These accessories are only available... pic.twitter.com/eGKdCdY9EU",technology samsung unveils latest mobile and entertainment accessories these accessories are only available pic twitter com egkdcdy eu,technology samsung unveils latest mobile entertainment accessories accessories available pic twitter com egkdcdy eu
Stand down: Samsung 's new speaker isn't an Echo competitor - CNET http:// buff.ly/2f5Trcn,Stand down: Samsung 's new speaker isn't an Echo competitor - CNET http:// buff.ly/2f5Trcn,stand down samsung s new speaker isn t an echo competitor  cnet http buff ly f trcn,stand samsung new speaker isn echo competitor  cnet http buff ly trcn
I liked a @YouTube video from @dailytekk http:// youtu.be/7UOW3x5CjpA?a Xbox One S 4K HDR Ultra-HD Blu-Ray Test ( Samsung KS8000),I liked a @YouTube video from @dailytekk http:// youtu.be/7UOW3x5CjpA?a Xbox One S 4K HDR Ultra-HD Blu-Ray Test ( Samsung KS8000),i liked a youtube video from dailytekk http youtu be uow x cjpa a xbox one s k hdr ultra hd blu ray test  samsung ks, liked youtube video dailytekk http youtu uow cjpa xbox hdr ultra hd blu ray test  samsung ks
???????? ??????? ?? ??????? samsung scx 4200 http:// polynesiaforum.ru/showforum/2/dr ayvera-skanera-na-printer-samsung-scx-4200/ ? #BQ #??????? #?????,???????? ??????? ?? ??????? samsung scx 4200 http:// polynesiaforum.ru/showforum/2/dr ayvera-skanera-na-printer-samsung-scx-4200/ ? #BQ #??????? #?????,    samsung scx  http polynesiaforum ru showforum dr ayvera skanera na printer samsung scx   bq,    samsung scx  http polynesiaforum ru showforum dr ayvera skanera na printer samsung scx   bq
"Galaxy Note 5 Bling Wallet Case, Samsung Galaxy Note 5 Diamond Case,Etsue Retro Tower http:// amzn.to/2eZ3bVq pic.twitter.com/h9tCYd74f4","Galaxy Note 5 Bling Wallet Case, Samsung Galaxy Note 5 Diamond Case,Etsue Retro Tower http:// amzn.to/2eZ3bVq pic.twitter.com/h9tCYd74f4",galaxy note  bling wallet case samsung galaxy note  diamond case etsue retro tower http amzn to ez bvq pic twitter com h tcyd f,galaxy note  bling wallet case samsung galaxy note  diamond case etsue retro tower http amzn ez bvq pic twitter com tcyd 
